id,title,score,upvote_ratio,num_comments,author,created_utc,url,over_18,edited
ye5ckz,"[UEFA] FC Barcelona have qualified for the 2022-2023 UEFA Europa League knockout stages, by finishing 3rd in Group C of the UCL!",21484,0.98,2119,1903_,2022-10-26 18:34:37,https://www.uefa.com/uefachampionsleague/match/2035709--inter-vs-plzen/standings/,False,False
8uaqqn,Son Heung-Min goal (Korea Rep [2]-0 Germany) 96',21475,0.94,2595,triza,2018-06-27 15:55:13,https://streamja.com/pMd6,False,False
p7mufw,Muhammed Gumuskaya tries to celebrate by kissing the Fenerbahce badge on his Puma kit...,21475,0.99,556,bishey3,2021-08-19 20:23:10,https://v.redd.it/i9b8xynnidi71,False,False
i9u0yx,Post Match Thread: Barcelona 2-8 Bayern Munich | UEFA Champions League [Bayern are through to the Semi-Finals],21466,0.99,11669,cuentuli,2020-08-14 20:50:17,https://www.reddit.com/r/soccer/comments/i9u0yx/post_match_thread_barcelona_28_bayern_munich_uefa/,False,False
iinxz0,"Lewandowski: ""I'd give the Ballon d'Or to myself. We've won everything there was to win and I was top scorer in every competition. Any other player in my position would receive it"".",21466,0.97,1053,None,2020-08-29 06:46:13,https://youtu.be/t6MrRHozqTA?t=136,False,False
te83ku,Vini Jr dancing in front of the Mallorca fans who reportedly were chanting racist things at him.,21457,0.97,500,ugotbaited,2022-03-14 21:19:31,https://v.redd.it/8dsia3mm1fn81,False,False
9w65ni,Bruno Petkovic (Dinamo Zagreb) insane goal,21452,0.95,353,culaso,2018-11-11 18:31:55,https://v.redd.it/d8l92abcwqx11,False,False
8et93x,Wenger: “If God exists & one day I go up there and he will ask: ‘What have you done in your life?’. The only answer I will have is: ‘I tried to win football games.’ He will say: ‘Is that all?’ And the answer I will have is: ‘It’s not as easy as it looks.’”,21442,0.9,490,Android_Arsenal,2018-04-25 12:43:45,https://www.theguardian.com/football/2016/oct/21/arsene-wenger-arsenal-seven-wins-beware-complacency,False,False
1gdzz5s,Erik ten Hag sacked as Manchester United manager,21435,0.99,2434,JayomaW,2024-10-28 11:45:34,https://www.nytimes.com/athletic/5854757/2024/10/28/erik-ten-hag-sacked-manchester-united/,False,False
kagdaw,Griezmann ends Huawei partnership following Ouighour persecution in China,21389,0.96,1685,Scusemahfrench,2020-12-10 14:39:25,https://www.instagram.com/p/CInqQ5-ptdP/,False,False
oiuqlp,Harry Kane and Kalvin Phillips magically heal from an injury .,21387,0.89,2394,bzogaj92,2021-07-12 16:27:13,https://v.redd.it/d8jusru46ta71,False,False
qauj5u,McArthur foul on Saka,21375,0.98,1399,90degreeturnsbtw,2021-10-18 19:52:20,https://v.redd.it/if46hom2k9u71,False,False
b2aa30,Betis 1-[4] Barcelona - Lionel Messi 85',21359,0.94,2105,Meladroit40,2019-03-17 21:30:25,https://streamja.com/6w4m,False,False
8tzq7k,"Des Kelly: All this whining about VAR is ridiculous. It’s like blaming CCTV for a burglary. If a referee watches a replay and STILL makes a bad decision then that’s down to the competence of the official, not the review system.",21367,0.93,1127,IronM2,2018-06-26 12:47:58,https://twitter.com/DesKellyBTS/status/1011516841544609792,False,False
bpdnzs,"Ajax Captain, Matthijs de Ligt catches a can of beer thrown at the mayor of Amsterdam at Ajax's title celebration",21356,0.94,1058,HerrHeydrich,2019-05-16 15:05:05,https://v.redd.it/cpzwxrbb8ly21,False,False
zp3wha,Emiliano Martinez great save against France 120+3',21357,0.98,899,None,2022-12-18 17:43:34,https://streamin.me/v/8d292fdb,False,False
zbko50,USA has been eliminated from the 2022 World Cup.,21330,0.94,3178,dragon8811,2022-12-03 16:53:01,https://www.fifa.com/fifaplus/en/match-centre/match/17/255711/285073/400128136,False,False
xtw3wa,The fastest players to 3 Premier League hat-tricks,21307,0.98,1349,None,2022-10-02 18:33:28,https://i.redd.it/voh6gc95sfr91.jpg,False,False
75bzfw,"Iceland [2]-[0] Kosovo. Iceland are through to the WC finals for the first time in its history, becoming the lowest populated nation to do so.",21305,0.92,1285,Goborn,2017-10-09 20:35:30,https://www.reddit.com/r/soccer/comments/75bzfw/iceland_20_kosovo_iceland_are_through_to_the_wc/,False,False
1e3cizq,[Spain] have won the UEFA EURO 2024,21297,0.95,3446,BVB-Oeli,2024-07-14 20:53:42,https://x.com/SEFutbol/status/1812591237544784123,False,False
bvjoku,Jose Antonio Reyes has lost his life in a car accident,21293,0.94,881,kokin33,2019-06-01 11:03:03,https://www.marca.com/futbol/2019/06/01/5cf25787ca474148698b459e.html,False,False
rbpzf7,"Salah on whether he’s ""convinced"" with the vaccine: they are doctors who have been working and studying medicine for years. if I said this is wrong then I'm like anyone on the street who would [correct my way of playing]. [the doctors] and WHO said so,so we must follow them.",21243,0.94,1467,finePolyethylene,2021-12-08 12:10:57,https://v.redd.it/wh490fmp4b481,False,False
d849lk,Sparta Prague 0 - [2] Slavia Prague - OG 55’,21238,0.97,434,ivanacapkova,2019-09-23 09:44:02,https://v.redd.it/4gt1zwb4ebo31,False,False
rc1yuc,[FC Barcelona] FC Barcelona has been knocked out from Champions League and qualified for Europa League,21206,0.98,1959,None,2021-12-08 21:53:27,https://twitter.com/fcbarcelona_cat/status/1468700227154624516?s=21,False,False
eiipy9,Brighton [1]-1 Chelsea - Jahanbakhsh 84',21131,0.93,825,digkektzthedream,2020-01-01 14:13:34,https://streamvi.com/watch.php?video=1577887995,False,False
zp4a6m,"[Opta Joe] Lionel Messi is the first player to score in the group stage, round of 16, quater-final, semi-final and final in a single edition of the World Cup. Prestige.",21118,0.96,1408,Task_Force-191,2022-12-18 18:03:04,https://twitter.com/OptaJoe/status/1604498100470648834?t=-xWdF7ZL2Qn5yIJ2AFzBDw&s=19,False,False
d9eode,Areola with a one-handed grab in Real Madrid's game against Osasuna,21006,0.96,719,FappinOnYerNexus,2019-09-26 04:25:16,https://i.redd.it/e7enoi498vo31.gif,False,False
oixk1d,"[Tyrone Mings on MP Priti Patel] You don’t get to stoke the fire at the beginning of the tournament by labelling our anti-racism message as ‘Gesture Politics’ & then pretend to be disgusted when the very thing we’re campaigning against, happens.",20979,0.93,1274,berober04,2021-07-12 18:42:38,https://twitter.com/OfficialTM_3/status/1414655312074784785,False,False
1ds79cy,England [1] - 1 Slovakia - Jude Bellingham great goal 90+5',20977,0.95,2515,PSGAcademy,2024-06-30 17:54:37,https://dubz.link/v/fbe118,False,False
hdyk3o,"Sam Lee on Twitter: ”There's a plane flying over the Etihad that says 'White lives matter - Burnley'. Fucking hell, what an absolute embarrassment. Absolute disgrace.”",20980,0.84,656,jeesprr,2020-06-22 19:05:47,https://twitter.com/samlee/status/1275142199898931203?s=21,False,False
8wmi94,Brazil 0-2 Beligum - De Bruyne 31' [2018 World Cup - Quarterfinals],20932,0.94,1880,HerbalDreamin,2018-07-06 18:32:23,https://www.clippituser.tv/c/kaqzan,False,False
zawgcd,Hwang Hee-Chan with his Player of the Match award,20912,0.98,309,StuartZero,2022-12-02 20:20:27,https://i.redd.it/drkrbiwc4l3a1.jpg,False,False
8kkehs,Match Thread: Prince Harry vs Meghan Markle [The Royal Wedding],20889,0.79,2605,00Laser,2018-05-19 10:18:12,https://www.reddit.com/r/soccer/comments/8kkehs/match_thread_prince_harry_vs_meghan_markle_the/,False,False
qdbyfn,"Galatasaray's goal against Locomotiv Moscow last night, nothing too fancy but simple and beautiful.",20883,0.98,439,None,2021-10-22 07:50:20,https://v.redd.it/edrccjzqiyu71,False,False
5keil2,Mkhitaryan scorpion kick goal vs Sunderland [3-0],20860,0.87,859,ICameHereToDrinkMilk,2016-12-26 16:47:59,https://streamable.com/y9vq7,False,False
i2uhh2,All three of Ross County FC's goalkeepers are called Ross,20831,0.99,499,squirrelinthetree,2020-08-03 10:14:09,https://www.transfermarkt.com/ross-county-fc/startseite/verein/2759/saison_id/2019,False,False
18hrb30,Alternate angles of Niklas Süle's spectacular save,20783,0.99,375,Its_ABR12,2023-12-13 21:11:21,https://v.redd.it/nzptpf70o46c1,False,False
bl3og7,Chelsea fan to Hazard “stay at chelsea” Hazard: *shakes his head*,20693,0.94,1010,B7omni,2019-05-05 22:02:30,https://v.redd.it/am1uczvjtgw21,False,False
enbugp,"After tonight's win Against Spurs, Liverpool has the best start to a season aggregating 61 pts from 21 league games which represents the best start to a campaign of any team in the history of Europe's top five leagues.",20677,0.9,1539,usXer,2020-01-11 19:22:36,https://www.skysports.com/football/news/11669/11905009/jurgen-klopp-says-liverpool-not-distracted-by-potential-european-record,False,False
ud6gi9,Aguero reacting to both 'Benzema goals' with Balotelli,20672,0.98,683,NeoIsJohnWick,2022-04-27 15:38:54,https://v.redd.it/sj76z4jmc3w81,False,False
j1gu6f,John McGinn with a Zidane pirouette,20653,0.99,472,lewjt,2020-09-28 17:46:28,https://v.redd.it/nsmnux0nexp51,False,False
4p87rv,Messi Freekick Goal v USA (2-0),20649,0.87,1991,None,2016-06-22 01:38:23,https://streamable.com/1igc,False,False
9kprde,"Peter Crouch: ""My wife doesn't like football. One day she called me 10 minutes before a game to find out where I was.""",20642,0.94,680,Tiwarii,2018-10-02 11:24:16,https://www.theguardian.com/lifeandstyle/2018/sep/29/peter-crouch-footballer-wife-doesnt-like-the-game,False,False
n3b2u4,"Jon Champion speaks his mind on the Glazer family, broadcast gets cut midway through",20570,0.98,1486,letsgetshady,2021-05-02 17:16:14,https://v.redd.it/75akdbimpqw61,False,False
ivw9lh,[Official] Gareth Bale returns to Tottenham Hotspur,20570,0.97,877,TomasRoncero,2020-09-19 16:58:41,https://www.realmadrid.com/noticias/2020/09/19/comunicado-oficial-bale,False,False
j3r1yt,Napoli center back Koulibaly criticize China for Uyghur concentration camps,20522,0.97,1241,Artuhanzo,2020-10-02 08:44:43,https://www.instagram.com/p/CFy4AdxFiPf/?igshid=14uzrjxzb2esn,False,False
107gu0f,[Gareth Bale] officially retires from football,20503,0.98,1879,CaIzuh,2023-01-09 15:14:33,https://twitter.com/GarethBale11/status/1612466979373461504,False,False
mk1yiq,Valencia Players Walk Off The Pitch After Alleged Racial Slur (Full Altercation) ( Reupload ),20496,0.96,2150,MorrCa,2021-04-04 18:34:40,https://v.redd.it/95c4a7w1a7r61,False,False
1c3yqzt,Bayer Leverkusen crowned as 2023/24 Bundesliga champions!,20483,0.99,1038,dragon8811,2024-04-14 17:20:17,https://www.bundesliga.com/de/bundesliga/spieltag/2023-2024/29/bayer-04-leverkusen-vs-sv-werder-bremen/liveticker,False,False
184ejnf,Everton 0 - [1] Manchester United - Alejandro Garnacho great goal 2',20450,0.98,1529,PSGCampus,2023-11-26 16:32:39,https://dubz.co/v/7j486q,False,False
r55jt1,"[Messi] to Lewandowski: ""Everyone knows and we all agree that you were the winner last year. Hopefully France Football will give you the Ballon d'Or 2020. We all believe you deserved it and I hope you can have it at home.",20440,0.97,1236,LordVelaryon,2021-11-29 21:00:45,https://twitter.com/SVargasOK/status/1465425268550610944,False,False
100rak8,Erling Haaland mocking Ben Godfrey,20436,0.98,645,Blu-10,2023-01-01 19:33:39,https://v.redd.it/tji1q2qqhh9a1,False,False
8z93nv,Steven N'Zonzi had to ask certain players to let N'Golo Kanté hold the World Cup trophy because the man himself was too shy to ask & didn't want to impose on anyone.,20413,0.92,965,a-kainth,2018-07-16 08:06:10,https://streamable.com/2aei7,False,False
png9ln,Ibrahimovic stops tying his shoes and scores the goal against Lazio,20388,0.99,492,bzogaj92,2021-09-13 14:12:35,https://v.redd.it/oj6jti2k3an71,False,False
j661io,"[Mesut Özil] I was so sad that Jerry Quy aka our famous & loyal mascot @Gunnersaurus an integral part of our club was being made redundant after 27 years. As such, I’m offering to reimburse @Arsenal with the full salary of our big green guy as long as I will be an Arsenal player...",20356,0.98,1482,TheGoldenPineapples,2020-10-06 14:30:02,https://twitter.com/MesutOzil1088/status/1313486190947991556?s=20,False,False
90znxt,Official: Mesut Özil retires from german national team,20353,0.92,3663,BVB-Oeli,2018-07-22 18:04:55,https://twitter.com/MesutOzil1088/status/1021093637411700741,False,False
oi2hwp,"Messi is the first ever player to have most goals, most assists, player of the tournament, winner of the tournament at a major international tournament.",20318,0.96,1127,just_a_random_guy_11,2021-07-11 11:03:34,https://en.wikipedia.org/wiki/2021_Copa_América#Statistics,False,False
1ay9rkp,Xabi Alonso's reaction to Granit Xhaka's fake injury celebration,20298,0.99,411,dragon8811,2024-02-23 19:46:34,https://v.redd.it/nxurcmkn2ekc1,False,False
861y07,"Ronaldo on 2002 World Cup: ""Everyone talked about my leg injury, so I decided to cut my hair and leave the small piece there. I could relax and stay calm then because everyone focused on my hair. I'm not proud about it -- it was a strange look, but it was a good way to change the subject.""",20272,0.94,659,AlwaysSnowyInSiberia,2018-03-21 13:10:46,http://www.espn.co.uk/football/brazil/story/3427029/ronaldos-2002-world-cup-haircut-deliberately-distracted-media-from-injuries,False,False
u7api1,Sky Sports readers combined Liverpool and Manchester United XI.,20272,0.96,927,Theumaz,2022-04-19 17:35:26,https://i.redd.it/z7drha3huiu81.jpg,False,False
e24p6u,Mourinho thanks ball boy after quickly retrieving ball for the goal,20255,0.95,666,thedonmoose,2019-11-26 21:17:28,https://streamable.com/i21xi,False,False
10ir418,David de Gea Fallon d’Floor Candidate,20264,0.96,961,PoliQU,2023-01-22 18:56:55,https://v.redd.it/ebm199zwnoda1,False,False
n37wls,Inter are the 2020/2021 season Serie A champions.,20259,0.97,1068,sonyhren1998,2021-05-02 14:50:57,https://www.reddit.com/r/soccer/comments/n37wls/inter_are_the_20202021_season_serie_a_champions/,False,False
oinkq9,"Jose Mourinho : ""For Saka to have the destiny of a country on his shoulders, I think it is too much for a kid to have everything on his shoulders in this moment...In reality, it is very hard for Rashford and Sancho to come and take a penalty after one touch of the ball.""",20190,0.97,1300,Sumit316,2021-07-12 09:06:29,https://www.goal.com/en-in/news/mourinho-works-shaw-into-saka-penalty-question-after/18or0nqto0zdl1o6q28tb4zwxc,False,False
baxxzv,Chelsea [1]-0 West Ham : Hazard 24',20183,0.91,1595,paicmhsc,2019-04-08 19:24:01,https://streamja.com/n947,False,False
tai9xy,Real Madrid [3] - 1 PSG - K. Benzema 78',20174,0.98,2713,triza,2022-03-09 21:36:46,https://streamja.com/49zzz,False,False
z0aoza,[Eric Njiru] Qatar become the first FIFA World Cup host to lose the opening game.,20149,0.98,1437,LampseederBroDude51,2022-11-20 18:01:22,https://twitter.com/EricNjiiru/status/1594390234770333698,False,False
ccanzk,OFFICIAL: Griezmann signs for Barça,20112,0.9,1444,gandifc,2019-07-12 13:11:39,https://twitter.com/fcbarcelona/status/1149667415564922880?s=21,False,False
8s2gfm,H. Kane goal (Tunisia 1-[2] England) 91',20110,0.86,2663,triza,2018-06-18 19:50:06,https://streamja.com/aXlB,False,False
ftvy55,"Carlos Tevez: ""Footballers can live for six months without getting paid, they are not in the same despair as those who have to leave their house at six in the morning and return at seven in the evening to feed the family""",20098,0.97,681,der_Globetrotter,2020-04-02 22:23:39,https://www.beinsports.com/en/football/news/coronavirus-footballers-can-live-for-six-mo-1/1443666,False,False
6mti2y,"An Italian magazine just elected this as the worst 20 seconds of football ever played (QPR v. Man City, 1993)",20093,0.94,902,xanthias91,2017-07-12 12:08:59,https://twitter.com/ianblair99/status/883470264738107393,False,False
z8hqtn,Antonee Robinson embraces the distraught Ramin Rezaeian at full time. USA vs Iran.,20093,0.98,802,PringleJones,2022-11-30 04:52:02,https://v.redd.it/1gnc8sr9r03a1,False,False
qh81k6,[OFFICIAL] Ronald Koeman has been sacked as manager of Barça,20064,0.99,1677,Fati25,2021-10-27 22:14:22,https://www.fcbarcelona.cat/ca/futbol/primer-equip/noticies/2311932/koeman-destituit-com-a-tecnic-del-primer-equip,False,False
8bb15t,AS Roma 3-0 Barcelona - Kōnstantinos Manōlas 82'' (Champions League - Quarter-finals),20068,0.9,2054,gemifra,2018-04-10 20:23:30,https://a.pomfe.co/zgtyai.mp4,False,False
o94bne,[Gary Lineker] Lukaku being pulled back and refusing to fall down and then not getting a freekick is exactly why players dive. Referees need to reward honesty if it’s to change.,20051,0.98,707,heyzeus92,2021-06-27 19:55:12,https://twitter.com/GaryLineker/status/1409235149926113288?s=19,False,False
folv4d,Gareth Bale great run vs Barcelona - Copa Del Rey 2014 final.,20043,0.94,731,atljv,2020-03-25 07:00:14,https://v.redd.it/qc3rio3ooro41,False,False
z0xcfq,[NEXTA] Budweiser will give the winning country all the beer prepared for the QatarWorldCup2022 worth of €75 million. It is also expected that the company will sue FIFA for breach of contract,20040,0.99,1077,StuartGT,2022-11-21 12:05:11,https://twitter.com/nexta_tv/status/1594641973880684549,False,False
c1qpfz,"Falcao: If Messi scores a goal, he'll be asked for two. If he scores from a free kick, they'll say the wall was not lined up correctly. If Argentina loses, there will be talk that it was his fault. That's the price he has to pay for being the best player in the world.",20018,0.91,950,JuanG12,2019-06-17 17:52:34,https://twitter.com/mundodeportivo/status/1140563144768663557,False,False
mnelb0,[ESPNUK]Police have confirmed the man who ran onto the pitch naked during Granada vs. Man United sneaked into the stadium at 7am.He hid under a canvas for 14 hours waiting for the game to start.,20000,0.99,574,OkYoghurt2997,2021-04-09 10:52:12,https://twitter.com/ESPNUK/status/1380470146423218179?s=19,False,False
k57z2b,"[Copa90] 10 years ago today, 22 people voted to award the 2018 and 2022 World Cups to Russia and Qatar respectively. 15 of them are are now either banned from FIFA for life, suspended, imprisoned, or fighting extradition to the USA to face federal charges. Only one still actually works for FIFA",19991,0.99,1617,A_Kind_Shark,2020-12-02 12:00:59,https://twitter.com/ElMengem/status/1334096312090849280,False,False
tpu7mb,[Canada] have qualified for the 2022 FIFA World Cup,19987,0.97,1306,honestlynotBG,2022-03-27 21:54:21,https://twitter.com/CanadaSoccerEN/status/1508200731421163520,False,False
9028q8,Corinthians keeper Cássio incredible two times save against Botafogo.,19948,0.96,423,PoppyK,2018-07-19 03:23:22,https://v.redd.it/xr16mzotota11,False,False
e6f84h,Zlatan Ibrahimovic speaking about the cost for children to play football in USA.,19940,0.94,2887,GoodGuyJack10,2019-12-05 10:09:30,https://www.reddit.com/r/soccer/comments/e6f84h/zlatan_ibrahimovic_speaking_about_the_cost_for/,False,False
pvpa2v,Azpilicueta weird movement on Grealish 51',19909,0.99,762,Fati25,2021-09-26 07:43:11,https://v.redd.it/d7rv8dzwxsp71,False,False
1dwu0sk,England attempt their new short corner routine 30',19860,0.99,576,50lipa,2024-07-06 16:51:49,https://v.redd.it/cy47ki8ehxad1,False,False
mu1w3m,"[VG] Ståle Solbakken [Norwegian NT manager]: ""In the past few years Juventus has been knocked out by Lyon, Porto and Ajax. Why the fuck do they want to be in that competition. Spurs and Arsenal aren't even top 20 teams in Europe at the moment""",19850,0.98,988,donfelicedon2,2021-04-19 14:32:41,https://www.vg.no/sport/fotball/i/JJe7dj/uefa-president-truer-gigantene-refser-fotballtopper,False,False
onieoa,[ARAesports] Barcelona have ruled out H&M as a sponsor because the Swedish clothing retail company had earlier denounced China for using forced labours and exploitation of Uighur Muslims. Barça don't want to create any conflict with China.,19848,0.95,2148,luczade,2021-07-19 17:09:17,https://www.ara.cat/esports/barca-renuncia-patrocini-motius-politics_1_4059712.amp.html?__twitter_impression=true,False,False
x807y2,Chelsea Football Club part company with Thomas Tuchel,19782,0.99,4098,dragon8811,2022-09-07 09:06:12,https://www.chelseafc.com/en/news/article/chelsea-football-club-part-company-with-thomas-tuchel,False,False
1gal32d,Slow-mo replay of Erling Haaland's flying backheel wonder goal against Sparta Prague,19777,0.97,687,50lipa,2024-10-23 20:53:38,https://v.redd.it/zh0qiy94kkwd1,False,False
15w38jh,Messi Giving Yedlin (former Inter Miami Captain) the captain's arm band to lift the trophy together.,19744,0.96,786,sarsourus,2023-08-20 06:06:57,https://v.redd.it/k68mykwxh7jb1,False,False
1fmyuvh,Haaland throws the ball at Gabriel after they score,19687,0.97,1280,oklolzzzzs,2024-09-22 17:38:40,https://v.redd.it/9ohlgu43deqd1,False,False
8vjhtz,Neymar rolling around in pain after getting stepped on by Layún,19670,0.9,5234,HerbalDreamin,2018-07-02 15:27:43,https://www.clippituser.tv/c/lnwbyz,False,False
z4jn8i,"After The Netherlands draw, Qatar are eliminated from the 2022 FIFA World Cup at the group stage",19644,0.98,1114,Mcool18,2022-11-25 17:56:43,https://www.fifa.com/fifaplus/en/match-centre/match/17/255711/285063/400235452?competitionEntryId=17,False,False
iminf8,Messi interview with Goal,19650,0.98,3336,RedditAccountNo132,2020-09-04 16:02:59,https://www.goal.com/es/noticias/lionel-messi-en-goal-jamas-iria-a-juicio-contra-el-club-de/f1rk5x1dmnmm1cay5rgxz71ie,False,False
6q401j,Syrian player scores by lobbing the goalkeeper with a running backheel from 30 meters out,19630,0.93,679,RigasUT,2017-07-28 14:06:20,https://streamable.com/lge7a,False,False
10v371q,[Martin Zigler] BREAKING: Man City charged by Premier Leaue with numerous breaches of financial rules following a four-year investigation. This is unprecedented:,19582,0.98,2716,tankosaurus,2023-02-06 10:17:12,https://twitter.com/martynziegler/status/1622539544078827520,False,False
qlfezg,Busquets miraculously recovers from his injury as Dynamo recovers possession,19570,0.98,1150,TheyCallHerBlossom,2021-11-02 22:01:24,https://v.redd.it/yn0t9byk89x71,False,False
8en4z7,Liverpool 1-0 Roma - Salah 36' [UEFA Champions League Semifinal],19572,0.89,1444,HerbalDreamin,2018-04-24 19:20:49,https://www.clippituser.tv/c/wyggzz,False,False
o4spkg,"[Derek Rae] Goretzka “It is nice to once again have 82 million people who think they’re the coach of Germany, rather than 82 million virologists.”",19560,0.98,807,CubedMadness,2021-06-21 11:11:58,https://twitter.com/raecomm/status/1406930432109813763?s=21,False,False
m7zh6p,Dinamo Zagreb [3] - 0 Tottenham [3-2 on agg.] - Mislav Orsic 106',19566,0.98,1418,alexinup,2021-03-18 20:08:42,https://streamye.com/voj7w,False,False
qg7cn7,"[Sky Germany] Picture of Sky Germany on their Transfer Update Show, as they taunt Jadon Sancho, showing him in a suit as James Bond: ""They call me 007: 0 goals, 0 assists, 7 games""",19539,0.97,1182,MoneyMasonMount,2021-10-26 14:15:27,https://i.imgur.com/hWi7hNg.jpg,False,False
8x31sc,"Club Tijuana have a “Neymar Challenge” during half-time, where fans roll from half field to the other side of the pitch",19532,0.93,1098,bendylegs12,2018-07-08 17:25:32,https://twitter.com/franciscoefv/status/1015791887272120320,False,False
crz5t9,José Mourinho tears up while saying he misses football,19530,0.92,1036,khoulzaboen,2019-08-18 09:28:11,https://v.redd.it/2clwubooe6h31,False,False
118nn18,Check out this sick goal my daughter scored!,19520,0.92,779,Greinstine,2023-02-22 03:25:40,https://v.redd.it/cqc7osh1apja1,False,False
991lns,"Appie Nouri, the Ajax player who has been in a coma for over a year, has woken up and started to communicate with his family.",19470,0.9,378,IfYouRun,2018-08-21 09:05:45,https://twitter.com/talkSPORT/status/1031798498507874305,False,False
137z6r1,[Napoli] have won the 2022-23 Serie A,19474,0.99,1047,321142019,2023-05-04 20:37:30,https://twitter.com/sscnapoli/status/1654223708050046976?cxt=HHwWgIDSldbs_fQtAAAA,False,False
nfj7gd,Pogba and Amad waving the Palestine flag,19446,0.84,2424,ID6WU,2021-05-18 19:06:04,https://i.redd.it/37ra0dzcgxz61.jpg,False,False
6lu4p9,RIP Bradley,19412,0.84,959,ausernameerno,2017-07-07 14:48:43,https://twitter.com/bradleysfight/status/883336169253203968,False,False
nbhia1,"In yesterday’s game Lautaro Martinez and Conte had a verbal disagreement after the double substitution, today they organized a boxing match between the two, with Lukaku as the host.",19369,0.98,561,Ipatovo,2021-05-13 14:09:50,https://v.redd.it/lojj1vhvawy61,False,False
rgwwyu,[BBC Sport] Sergio Agüero announces his retirement from football.,19366,0.99,1078,mrhello18,2021-12-15 11:23:12,https://twitter.com/BBCSport/status/1471078183327911936?s=20,False,False
9jeoxp,"Karl Pilkington on supporting Manchester United: ""I feel like supporting United is like having a tortoise as a pet. I had a tortoise, and they are not entertaining to watch. You don't watch them, but you know you have got a bit of responsibility to show some interest.""",19361,0.94,716,TheJeck,2018-09-27 17:08:10,https://www.bbc.co.uk/sport/football/45651999,False,False
fm2kmt,"In 2015, Newcastle player Jonas Gutierrez recovered from cancer only to learn that owner Mike Ashley was not going to renew his contract. He scored one goal and assisted the other in the final game of the season which kept Newcastle in the Premier League.",19355,0.96,358,Ak_Ibrahim,2020-03-20 20:55:07,https://v.redd.it/kst1fzsn4wn41,False,False
pat4d1,How my team (Juventus) treated me for being wheelchair bound,19311,0.96,628,justelle1,2021-08-24 18:25:48,https://www.reddit.com/r/soccer/comments/pat4d1/how_my_team_juventus_treated_me_for_being/,False,False
fnfmqx,Ronaldinho's great free kick vs England- 2002 FIFA WC.,19314,0.96,737,atljv,2020-03-23 07:00:39,https://v.redd.it/6d5mgmg0fdo41,False,False
5pbhyk,Wayne Rooney stunning late free kick goal vs Stoke City (1-1),19302,0.84,1042,DarkNightSeven,2017-01-21 16:51:17,https://streamable.com/m4hj6,False,False
nqujoy,ESPN commentator's adverse reaction to an Mbappe dive,19295,0.98,1421,TomasRoncero,2021-06-02 19:47:40,https://streamable.com/afjsn6,False,False
