id,title,score,upvote_ratio,num_comments,author,created_utc,url,over_18,edited
oeyybx,"Interviewer to K. Schmeichel ""You're probably aware of the phrase ""it's coming home"". What would it mean for you to stop it from coming home?"" Kasper: ""Has it ever been home though? Have you ever won it"". Savage.",17801,0.97,2318,Najikill,2021-07-06 16:52:40,https://www.tv3sport.dk/sport/fodbold/nyheder/fraek-schmeichel-saetter-engelsk-journalist-pa-plads-har-i-nogensinde-vundet-em,False,False
15pwmiu,Dani Olmo turn vs Bayern Munich,17797,0.99,347,OneBall22Players,2023-08-13 11:36:57,https://v.redd.it/pp64dw936vhb1,False,False
ca8ofk,United States 2-0 Netherlands - Lavelle 69',17783,0.83,1381,Hippemann,2019-07-07 16:28:21,https://streamja.com/P21z,False,False
h9i0yj,Boris Johnson has rejected a plea from Marcus Rashford to reconsider the government’s decision not to extend its free school meals voucher system for low-income families over the summer holiday period.,17766,0.94,1482,KimmyBoiUn,2020-06-15 15:01:26,https://www.theguardian.com/football/2020/jun/15/boris-johnson-rejects-marcus-rashfords-plea-for-free-school-meals-over-summer,False,False
dz6ken,"Redknapp backs Pochettino for Arsenal: “You think the fans wouldn’t love him there? If you go in there and start winning, they would have taken Saddam Hussein in there when he was about, the fans don’t give a monkey's! If you start winning every week, they’re singing ‘there’s only one Saddam’.”",17756,0.94,775,None,2019-11-20 19:02:23,https://www.mirror.co.uk/sport/football/news/harry-redknapp-backs-mauricio-pochettino-20922010,False,False
8rswfo,Brazil 1-0 Switzerland - Coutinho 20' [2018 World Cup],17741,0.92,1158,HerbalDreamin,2018-06-17 18:19:39,https://www.clippituser.tv/c/bnnmbx,False,False
8puflx,Rosicky Jr scores a banger in Tomas Rosicky’s testimonial,17717,0.79,395,chaotic111,2018-06-09 17:39:34,https://v.redd.it/s8i3ixcqh0311,False,False
1anit8m,Qatar's Akram Afif performs card magic trick after scoring a penalty in the 2023 AFC Asian Cup Final,17711,0.97,465,None,2024-02-10 15:29:49,https://v.redd.it/o606l7cx0shc1,False,False
p8srat,Aston Villa 1-0 Newcastle - Danny Ings bicycle kick 45+3’,17685,0.99,543,deception42,2021-08-21 14:49:17,https://www.clippituser.tv/c/exvxpn,False,False
qo1smc,[ESPN UK] Man United had more shots on target against their own keeper than against Man City,17649,0.99,448,None,2021-11-06 14:48:45,https://twitter.com/ESPNUK/status/1456991611989147650?t=FOFmqSl_z1Srca-BzQBIhQ&s=19,False,False
pwds1o,"Freiburg manager, Christian Streich, in tears after the club played its final game at the iconic Black Forest stadium and the fans sang his name.",17640,0.99,390,Goofy_030,2021-09-27 09:54:44,https://v.redd.it/kf6lawp5q0q71,False,False
l3nskn,Actual heatmap of Inter's 2nd half vs Udinese today,17645,0.98,281,Gungerz,2021-01-23 23:54:48,https://i.redd.it/f79gl8m176d61.jpg,False,False
mljwzv,Ederson challenge vs Dortmund,17629,0.98,2301,WeTalkBoxing,2021-04-06 19:41:20,https://v.redd.it/lfskhrvcwlr61,False,False
xzk7xo,[Iker Casillas] I hope you respect me: I’m gay,17611,0.89,1231,SakaSupremacist,2022-10-09 12:15:18,https://twitter.com/ikercasillas/status/1579081769890250753?s=46&t=8DXJe8U3LOC9imKEw-0Jog,False,False
bff4cw,"Cristiano Ronaldo becomes the first player in history to win the Premier League, La Liga and Serie A.",17592,0.9,1176,MerciDidier,2019-04-20 18:03:01,https://twitter.com/goalstv3/status/1119660939496833024,False,False
tnjpee,"The game Italy-Macedonia was played at Palermo's stadium. Macedonia's winning goal was by Aleksandar Trajkovski, a former Palermo player. Here's his goals from the same(ish) spot on the very same stadium over the years",17597,0.98,439,dragonsky,2022-03-25 11:21:37,https://v.redd.it/o346idkpkip81,False,False
bdyrwk,Juventus 1-[2] Ajax : De Ligt 67' (agg. 2-3),17583,0.92,1562,paicmhsc,2019-04-16 20:28:16,https://streamja.com/pJ16,False,False
abj5b0,"World Cup 2022 host Qatar has just introduced 100% alcohol tax. Price of all beer, wine & spirits doubled overnight. Happy New Year",17568,0.95,1764,scadonl,2019-01-01 15:53:24,https://twitter.com/skykaveh/status/1079895780146728960?s=12,False,False
mrpa1f,"[Artur Petrosyan] Rostov Uni manager Viktor Zubchenko: ""If I had Hitler, Napoleon and this referee in front of me, and only two bullets, I would shoot the referee twice.""",17565,0.98,1019,1903_,2021-04-15 22:04:19,https://twitter.com/arturpetrosyan/status/1382737179487649794,False,False
fbevqt,Hoffenheim and Bayern players stopped playing and pass the ball to each others,17551,0.96,2083,paicmhsc,2020-02-29 16:25:33,https://streamja.com/kW6rm,False,False
imytqo,"Yaya Toure, expelled from UNICEF's Soccer Aid after offering to take 19 prostitutes to the team's hotel",17529,0.99,984,jacamacho,2020-09-05 10:20:35,https://www.marca.com/futbol/futbol-internacional/2020/09/05/5f535fe9268e3e2a5b8b45ed.html,False,False
dpd3eb,Liverpool [5]-5 Arsenal - D. Origi 90+4',17517,0.89,1155,Hippemann,2019-10-30 21:22:31,https://streamja.com/GJyy,False,False
cxu179,A Romanian 4th League team forfeits their match today because one of the players has his wedding and they are all invited,17524,0.96,263,99xp,2019-08-31 09:30:40,https://www.gsp.ro/fotbal/liga-4/postarea-anului-in-fotbalul-romanesc-nu-ne-prezentam-la-meciul-de-azi-nimeni-nu-ne-intelege-d-576123.html,False,False
p3426q,OFFICIAL : Romelu Lukaku joins Chelsea FC,17507,0.95,1984,bzogaj92,2021-08-12 17:02:10,https://www.chelseafc.com/en/news/2021/08/12/romelu-lukaku-comes-home?cardIndex=0-0,False,False
cwienh,"Arsenal, Tottenham, Chelsea and Liverpool fans send an open statement to UEFA denouncing their bad experience in European finals, including awarding the games to places with questionable human rights records",17491,0.95,1004,JeebaRock,2019-08-28 09:32:31,https://www.theguardian.com/football/2019/aug/28/fans-uefa-final-tickets-human-rights-record,False,False
rsp9hg,One of the nicest football moments of 2021: the moment that Alpaslan Öztürk heard he was getting called up for the Turkish national team,17494,0.98,332,None,2021-12-31 08:25:34,https://v.redd.it/fqvm26kz8u881,False,False
10cgnzr,"After Everton fans shot fireworks at Southamptons hotel the night before the game, The Saints leave some lovely Hotel feedback!",17484,0.99,251,mike_tapley,2023-01-15 10:34:56,https://i.redd.it/zhnv9z4088ca1.jpg,False,False
lx06eg,"Ivan Rakitić to Leo Messi: ""You scored all those goals, but I have a trophy that you will never have. You will never win the Europa League.""",17461,0.98,429,TomexDesign,2021-03-03 18:02:42,https://www.24sata.hr/sport/rekao-sam-messiju-da-imam-trofej-koji-on-nikad-nece-imati-748746,False,False
1cuzntx,"Marco Reus for the final time steps off the pitch of Signal Iduna, what a moment",17463,0.99,393,dragon8811,2024-05-18 15:21:38,https://v.redd.it/5us6z0wvc71d1,False,False
8u31be,Marcos Rojo Goal (Nigeria 1-[2] Argentina),17450,0.89,2423,penguin672232,2018-06-26 19:45:07,https://streamja.com/vqjM,False,False
7tyhqn,"A front 3 of Henrikh Mkhitaryan, Pierre-Emerick Aubameyang, and Alexandre Lacazette contains the most letters of any forward line in the club's history. Wenger is clearly making the big name signings all the fans wanted.",17450,0.83,307,theJoyofMotion,2018-01-30 04:31:25,https://twitter.com/GranitZaka/status/958017288833327105?ref_src=twcamp%5Ecopy%7Ctwsrc%5Eandroid%7Ctwgr%5Ecopy%7Ctwcon%5E7090%7Ctwterm%5E3,False,False
f4wtj7,"Marega: ""I'd just like to say to those idiots who come to the stadium to make racist chants...fuck you 🖕🏾🖕🏾 And I also thank the refs for not defending me and giving me a yellow card for defending my skin color""",17427,0.93,900,TauIsRC,2020-02-16 20:38:56,https://twitter.com/marega91/status/1229141547641450499?s=20,False,False
uzwmwg,Real Madrid have won the 2021-22 UEFA Champions League,17408,0.9,3214,asr010601,2022-05-28 21:32:30,https://www.uefa.com/uefachampionsleague/match/2034586--liverpool-vs-real-madrid/,False,False
8z2gx4,France 1-[1] Croatia - Perišić 28' [2018 World Cup Final],17407,0.92,938,HerbalDreamin,2018-07-15 15:28:31,https://www.clippituser.tv/c/plamee,False,False
dbzjlt,Tottenham 2-[7] Bayern Munich - Gnabry 88',17391,0.92,1502,HerbalDreamin,2019-10-01 20:46:22,https://www.reddit.com/r/soccer/comments/dbzjlt/tottenham_27_bayern_munich_gnabry_88/,False,False
d6xugw,"Darek Formella found out, 3 hours before kick-off, that his father lost the battle against cancer. He decides not to tell his teammates and ended up scoring the winner, before breaking down during celebrations. Condolences to Darek during this difficult time.",17380,0.97,239,Sunny4k,2019-09-20 17:02:58,https://www.instagram.com/p/B2nSeMZHIx0/?igshid=1y2h11mt0i0n1,False,False
9c39gr,South Korea win the Asian Games. Heung-Min Son will not have to do military service.,17362,0.94,1106,keithohara,2018-09-01 14:03:17,http://www.jfa.jp/eng/national_team/u21_2018/asiangames_jakarta_2018_men/final/match_page/m16.html,False,False
s8r9qd,Kroos Yellow Card vs Elche,17350,0.99,658,HardyHar420,2022-01-20 19:46:06,https://v.redd.it/e0m5qtfncwc81,False,False
f8of74,[OC] The left foot of Gheorghe Hagi,17353,0.96,603,WeTalkBoxing,2020-02-24 08:41:41,https://v.redd.it/vv3vrdfj3ui41,False,False
4hjofy,Eden Hazard goal vs Tottenham (2-2),17338,0.83,912,rodrigoelcrack,2016-05-02 20:41:36,https://streamable.com/e7e0,False,False
bzetgs,Atleast 1400 Nepali workers have lost their lives while constructing stadiums in Qatar.,17337,0.92,1073,bestinvalidusername,2019-06-11 16:43:43,https://thehimalayantimes.com/nepal/at-least-1400-nepali-workers-died-while-constructing-football-stadiums-in-qatar/,False,False
pde9r7,Arsenal fan has a great sense of humour.,17321,0.99,436,DoktorLove13,2021-08-28 17:39:30,https://v.redd.it/1m4m6v63x4k71,False,False
okqbs4,[Official] FC Groningen’s Arjen Robben decides to retire from football at the age of 37,17309,0.99,782,None,2021-07-15 10:46:21,https://twitter.com/arjenrobben/status/1415623419819958275?s=21,False,False
fmcvya,How does a managers baldness impact on his win percentage in the premier league? The age old question has finally been answered,17297,0.95,434,31_whgr,2020-03-21 10:14:52,https://i.redd.it/xho2sf3040o41.jpg,False,False
4gq03n,Saúl Ñíguez goal vs Bayern (1-0),17304,0.86,1062,rodrigoelcrack,2016-04-27 18:56:33,https://streamable.com/fdy9,False,False
wuxy13,Scene after Defensa y Justicia's stoppage time defeat to Boca Juniors. Kid invades the pitch... to console goalie Ezequiel Unsaín.,17277,0.99,299,Joe_AM,2022-08-22 16:19:08,https://v.redd.it/490zu1lniaj91,False,False
fbhlvu,"Liverpool's unbeaten Premier League season has come to an end, Arsenal remain the only team to go the full season Unbeaten in the Premier League.",17281,0.95,1251,keithohara,2020-02-29 19:25:17,https://www.premierleague.com/match/46883,False,False
8y1x2y,Trippier (England) goal vs. Croatia (0-[1]),17266,0.87,1322,TomasRoncero,2018-07-11 18:05:23,https://www.clippituser.tv/c/elggxb,False,False
1c3ywd5,Bayer Leverkusen fans invade pitch after full time whistle,17260,0.99,419,Omar_Til_Death,2024-04-14 17:26:41,https://v.redd.it/2wh9qtttbhuc1,False,False
f5ezgf,Maguire kicking Batshuayi in the nuts 21',17264,0.92,1351,LeopoldMashallah,2020-02-17 20:24:03,https://streamja.com/4KZG,False,False
bwly07,"Of the 22 FIFA Executive Committee members who voted to award the 2018 and 2022 World Cups to Russia and Qatar, nearly all of them are either banned from football, convicted of fraud, indicted by government authorities, or accused of some level of corruption and malpractice.",17226,0.97,540,GoodSamaritan_,2019-06-04 07:28:04,https://i.redd.it/1r6hcisqia231.jpg,False,False
yz6z6b,[Rob Harris] FIFA President Gianni Infantino at news conference in Qatar: “Today I feel Qatari. Today I feel Arab. Today I feel African. Today I feel gay. Today I feel disabled. Today I feel a migrant worker. ... I know what it feels to be discriminated … I was bullied because I had red hair.”,17226,0.97,1881,teiraaaaaaa,2022-11-19 08:15:02,https://twitter.com/RobHarris/status/1593877426244812800,False,False
7s0vj2,Lyon 2-1 PSG : Memphis 90+4',17222,0.91,815,paicmhsc,2018-01-21 21:57:19,https://streamable.com/w66s9,False,False
b0xntz,Rooney vs Aguero vs Ronaldo vs Messi vs Higuain vs Suarez vs Benzema vs Lewandowski goals at the same age,17191,0.96,1389,aakash_huilgol,2019-03-14 08:05:25,https://streamja.com/1Jgd,False,False
iq52ra,"Eden Hazard turned up overweight, which upset Zidane. Real Madrid are upset with Hazard as well, because the player is not in required condition and it's a repeat of what happened last year. The player said last year that he loves to enjoy summer and eat then again this year.",17192,0.99,1626,MondayNightVAR,2020-09-10 15:06:08,https://www.abc.es/deportes/real-madrid/abci-madrid-enfadado-hazard-202009101217_noticia.html,False,False
mtzugv,[Romano] UEFA’s Alexander Ceferin confirms: “The players that will play in the Super League will be banned from playing in the World Cup and Euros. Ceferin. They will not be allowed play for their national teams”. 🚫🇪🇺 #SuperLeague,17168,0.99,2495,azgx29,2021-04-19 12:47:39,https://twitter.com/fabrizioromano/status/1384126392623714310?s=21,False,False
ysbbu3,Gerard Piqué poses with all the trophies he won at Barcelona.,17161,0.97,515,Golovking,2022-11-11 14:00:38,https://i.redd.it/63mpoqbwvbz91.jpg,False,False
ypg4ig,"Blatter: 'The 2022 World Cup was supposed to go to the US. A week before the FIFA-convention Platini called me that he had just spoken with the French president Sarkozy, who told him to vote for Qatar. Six months later Qatar bought fighter jets from France for 14.6 billion dollar.'",17156,0.99,1271,Nouri34ever,2022-11-08 08:54:00,https://www.vi.nl/nieuws/blatter-qatar-is-een-vergissing-de-keuze-was-slecht,False,False
1fxkpgf,Cole Palmer casually sat on the pitch while Chelsea and Nottingham Forest players got into an altercation,17145,0.99,603,MajesticAd5047,2024-10-06 16:39:44,https://v.redd.it/c9rrgb4dz5td1,False,False
f69ofa,[OC] The acceleration of Ronaldo Nazario,17145,0.97,1007,WeTalkBoxing,2020-02-19 11:36:19,https://v.redd.it/kn5ghhvy9vh41,False,False
1fsr5ut,"José Mourinho got booked for putting a laptop in front of the tv cameras, showing a ‘wrong’ call by the referee",17128,0.99,412,MobileTheft,2024-09-30 09:05:19,https://v.redd.it/xhpg6dtmwwrd1,False,False
11iunbv,Horrific tackle in a Japan's amateur match,17110,0.97,342,None,2023-03-05 11:12:39,https://v.redd.it/j8swdaxulwla1,True,False
il6vnx,Neymar Jr tests positive for COVID-19,17079,0.98,1053,UndeadPrs,2020-09-02 13:34:50,https://www.lequipe.fr/Football/Actualites/Coronavirus-neymar-teste-positif/1167224,False,False
10f1jdm,"Guardiola's three former assistants and disciples, Arteta, Xavi and Kompany, now at the top of their respective league standings.",17054,0.96,1019,ShirleyChen881,2023-01-18 07:42:51,https://i.redd.it/22rmw97garca1.png,False,False
9l4gku,I. Rakitić great goal (Tottenham 0-[2] Barcelona) 28',17043,0.92,747,triza,2018-10-03 19:28:32,https://streamja.com/Mkrv,False,False
b1q7s0,Who spent more money? Credit-Football dor,17035,0.95,1646,Qu3en-,2019-03-16 08:23:41,https://v.redd.it/nrzgdlefxfm21,False,False
18w87s1,Klopp loses his wedding ring in the post match celebrations,17006,0.98,319,blastburnite,2024-01-01 22:08:08,https://v.redd.it/dxk48lnmjw9c1,False,False
mu5vt7,"[Chris Williams] A new UEFA meeting will take place in the next 24 hours. There will be a motion to formally expel #mufc and Arsenal from the Europa League and Manchester City, Chelsea and Real Madrid from the Champions League",17004,0.99,2392,None,2021-04-19 17:34:39,https://twitter.com/chris78williams/status/1384193081746984961?s=21,False,False
iqopjm,Edinson Cavani performed with Uruguay's national ballet to encourage more male participants in ballet and challenge the stigma that it's not for boys,17006,0.98,559,Jayveesac,2020-09-11 11:31:32,https://twitter.com/lmechegaray/status/1304199259705806848,False,False
zbqy7v,Lionel Messi with his man of the match trophy.,16981,0.95,554,MindMaster115,2022-12-03 21:16:41,https://i.redd.it/1zpl5vrp1r3a1.png,False,False
z36lau,Qatari Royal Police on horseback followed by Mexican fans using the same mode of transportation during the World Cup,16969,0.98,355,MyMoonMyMan,2022-11-24 01:26:46,https://v.redd.it/zwavjg8hws1a1,False,False
9j67jy,E. Hazard goal (Liverpool 1-[2] Chelsea) 85',16972,0.9,1360,triza,2018-09-26 20:27:23,https://streamja.com/AnXR,False,False
9npq9j,"""If we were to hold a minute of silence for every estimated death of a migrant worker due to the constructions of the Qatar World Cup, the first 44 matches of the tournament would be played in silence"" Leader of Norwegian Confederation of Trade Unions",16958,0.96,770,aaupa,2018-10-13 00:40:42,https://twitter.com/lonorge/status/1050650361873096704,False,False
dva9zl,Chelsea first team player fines,16944,0.95,1154,None,2019-11-12 13:54:52,https://i.redd.it/f8301qtdc9y31.jpg,False,False
iegc5z,Daily Mail on Sterling buying his parents a house: 180K a week flop showing off his house.....hours after flying home in disgrace from Euro 2016. Daily Mail on Maguire's arrest: He is everything United wanted in a captain. So his arrest comes as a huge shock.,16942,0.95,1280,ankitm1,2020-08-22 10:43:58,https://twitter.com/HLTCO/status/1297065868443168773,False,False
oz2ae4,"[MisterChip] Lionel Messi has won 35 trophies with Barcelona, 36,4% percent of all the trophies Barcelona has won in their 122-year history. Messi scored 671 goals and assisted another 267 in 778 games, meaning he was responsible for 1 in 11 goals in the history of Barcelona.",16918,0.98,569,Nouri34ever,2021-08-06 08:04:11,https://twitter.com/2010MisterChip/status/1423400324975448064,False,False
c4y7k2,Luis Suarez appealing for a handball from the Chilean goalkeeper,16880,0.95,754,TomasRoncero,2019-06-24 23:34:59,https://streamable.com/29cdq,False,False
c9xpbv,Messi (Argentina) and Medel (Chile) red cards 37',16857,0.93,3102,Hippemann,2019-07-06 19:40:54,https://streamja.com/vv1b,False,False
5ny9tj,Andy Carroll goal vs Crystal Palace(2-0),16846,0.87,805,ClassicSwarley,2017-01-14 16:36:48,https://streamable.com/fyyjc,False,False
ybrasb,Gavi receiving treatment on the pitch,16841,0.98,328,Patrom88,2022-10-23 19:56:13,https://v.redd.it/j8ri3ph12mv91,False,False
mvdwsj,UEFA is set to be hit with a concerted campaign to drop its plan for two Champions League places awarded on the basis of historical performances in Europe.,16851,0.99,1671,KimmyBoiUn,2021-04-21 11:47:23,https://www.thetimes.co.uk/article/european-super-league-uefa-under-pressure-to-ditch-champions-league-coefficient-safety-net-hf3chr2lk,False,False
alibf6,Barcelona [6]-1 Sevilla [6-3 on agg.] - Messi 93',16840,0.92,975,Ragnar016,2019-01-30 22:23:14,https://streamable.com/jaulz,False,False
1gcusjh,Hansi Flick header vs Real Madrid,16832,0.99,151,Chelseatilidie,2024-10-26 21:00:15,https://v.redd.it/fkn46uu206xd1,False,False
nd4ugp,schmeichel mental save,16826,0.98,456,Harvey-knibbs,2021-05-15 18:08:34,https://v.redd.it/p19ximhcrbz61,False,False
66xbpe,Chelsea 4-2 Tottenham (Matic 80') Brilliant Goal,16829,0.87,941,None,2017-04-22 17:55:45,https://streamable.com/q8fmb,False,False
yuj6i9,"On this day 10 years ago, Zlatan Ibrahimovic scores one of the most ridiculous goals you’ve ever seen for Sweden against England (Great Goal)",16812,0.99,551,Utter_Perfection,2022-11-14 00:01:20,https://v.redd.it/ix6g3f3r4tz91,False,False
13ei1i7,AC Milan fans after the game,16814,0.98,464,watermaloneyyy,2023-05-11 09:22:05,https://v.redd.it/h4zz5aolo7za1,False,False
i4narr,Arsenal players not happy with 55 staff being made redundant. They agreed 12.5% wage cut in April after receiving assurance nobody would lose jobs. Yesterday’s news left squad angry & they plan to raise it with #AFC bosses.,16791,0.99,1204,PandaSwears,2020-08-06 07:27:32,https://twitter.com/David_Ornstein/status/1291274276851593217,False,False
ecvlks,"Although only playing for 2 seasons, Zlatan Ibrahimovic is the top scorer of the decade for AC Milan, recording 42 goals in 61 league games",16778,0.96,507,JoppeDalle,2019-12-19 16:34:00,https://www.transfermarkt.com/zlatan-ibrahimovic/alletore/spieler/3455,False,False
durnob,"Taison: ""In a racist society it is not enough not to be racist, you have to be anti-racist.""",16773,0.86,1266,NevenSuboticFanNo1,2019-11-11 12:21:32,https://twitter.com/migquintana/status/1193847150473555968?s=19,False,False
64se5r,"There has been an explosion close to the BVB-teambus, the game against Monaco could be cancelled",16731,0.91,1988,footysocc,2017-04-11 17:43:48,"http://www.bild.de/sport/fussball/champions-league/explosion-am-mannschaftsbus-von-borussia-dortmund-51257066,la=de.bild.html",False,False
becx3a,Post-Match Thread: Manchester City 4-3 Tottenham Hotspur (4-4 on aggregate) [UEFA Champions League Quarterfinal | Second Leg],16722,0.91,5292,AdventurousChapter,2019-04-17 20:54:51,https://www.reddit.com/r/soccer/comments/becx3a/postmatch_thread_manchester_city_43_tottenham/,False,False
f4nibe,"Mamadou Sakho: ""I lost my father when I was 13. Soon I had to become a man. For me, it wasn't an option to play football, it was a must. Someone asked me if it was difficult to be PSG captain at 17, for me the hardest thing was to become captain of my family at 13.""",16711,0.94,288,amitkon,2020-02-16 07:43:16,https://www.reddit.com/r/soccer/comments/f4nibe/mamadou_sakho_i_lost_my_father_when_i_was_13_soon/,False,False
8seg6f,Senegalese fans pick up trash after World Cup match against Poland,16704,0.94,610,None,2018-06-20 01:47:01,https://i.imgur.com/HTiTSMM.gifv,False,False
o1u73q,Russia's coach drinking Coca Cola on a press conference after Ronaldo removing the bottles on his press conference.,16706,0.96,1592,just_a_random_guy_11,2021-06-17 10:40:44,https://v.redd.it/qim8a2ej1t571,False,False
ifb1s4,Bayern Munich win the 2019-20 Champions League and complete the treble,16697,0.97,1737,BastianMobile,2020-08-23 20:53:26,https://twitter.com/FCBayern/status/1297638062588125184,False,False
iy4z41,The heartbreak of Roy Keane,16678,0.99,859,Eagle_Powers_,2020-09-23 06:30:18,https://v.redd.it/doqgw5r4duo51,False,False
s8fmy7,"Pierre Højbjerg grabbing the shirt of Steven Bergwijn, who is on a yellow card, to prevent him from celebrating with the fans to avoid him getting suspended",16675,0.98,508,Dark_Wolf04,2022-01-20 10:04:20,https://v.redd.it/sni3tnmugtc81,False,False
mx0yg3,Video of #KroenkeOut protests outside the Emirates,16668,0.99,913,ahouseofgold,2021-04-23 17:50:33,https://v.redd.it/lymtmtesnyu61,False,False
dhnjah,All current Europe league leaders,16679,0.91,1143,None,2019-10-14 08:09:46,https://i.imgur.com/MjBhRVl.jpg,False,False
10elde3,"BBC has an ""interesting audio error"" during Wolves vs Liverpool (volume warning)",16676,0.99,514,doubleoeck1234,2023-01-17 19:43:02,https://v.redd.it/zbxctl63qnca1,True,False
jssrbi,Puskas Contender from Danish Cup (better video quality),16662,0.99,489,TheFogOfVAR,2020-11-12 11:02:24,https://streamable.com/0q9p4n,False,False
v094wd,[Ele] Kroos and Modrić after the win,16644,0.96,520,asr010601,2022-05-29 11:22:59,https://v.redd.it/urbp9kxxfe291,False,False
iiw9c2,Messi informs Barca he will not show up for tomorrow's medical check,16635,0.99,1358,None,2020-08-29 17:20:09,https://twitter.com/elchiringuitotv/status/1299758482120376320,False,False
z3qidk,Better look at Diogo Costa almost making a fatal mistake late on.,16608,0.99,777,keithohara,2022-11-24 18:02:31,https://v.redd.it/9cji77ggcz1a1,False,False
zedpqn,Man of the match: Yassine Bounou!,16597,0.98,426,dragon8811,2022-12-06 18:14:54,https://i.redd.it/zy4v7dj1kb4a1.jpg,False,False
1e0e3m7,"Clearer footage of Darwin Nuñez's fistfight with Colombian fans in the stands, who allegedly began harassing his family members in attendance",16605,0.99,1768,bluefoxlive,2024-07-11 02:30:50,https://v.redd.it/utet188kwsbd1,False,False
v5iqxa,[FIFA World Cup]:Wales have qualified to the World Cup after 64 years of waiting!,16602,0.98,1764,Nervous-Resolution-8,2022-06-05 17:57:33,https://twitter.com/FIFAWorldCup/status/1533508219129184257?s=20&t=2LE3iC-Aij5NWawViDYPBQ,False,False
zaul9y,Cavani smashes the VAR monitor on the ground after the Ghana game.,16595,0.98,1781,Lamar_176er,2022-12-02 19:09:43,https://v.redd.it/84xer0u7aj3a1,False,False
1f0aoil,"McGinn kicks the ball at Saliba, White kicks the ball at McGin ",16574,0.99,585,nauett,2024-08-24 17:26:40,https://v.redd.it/11k0eeojcnkd1,False,False
89shm0,Liverpool 2-0 Manchester City - Alex Oxlade-Chamberlain 21' (Champions League - Quarter-finals),16564,0.9,1404,gemifra,2018-04-04 19:07:46,https://streamable.com/n4gsx,False,False
emx8yw,Norwich squad toast a drink to Barrie Greaves who left £100 in his will to the squad to buy themselves a drink.,16572,0.96,468,banterray,2020-01-10 21:10:22,https://twitter.com/NorwichCityFC/status/1215737821224472577,False,False
8vlci6,Belgium 0-2 Japan - Inui 52' [2018 World Cup],16558,0.93,1717,HerbalDreamin,2018-07-02 19:10:05,https://www.clippituser.tv/c/zkeqzl,False,False
u305yh,Savic grabs Grealish's hair,16544,0.98,1347,RevertBackwards,2022-04-13 20:56:50,https://v.redd.it/uqfrbs3v0dt81,False,False
18jyecc,Replay and closer look at Oshimen assist for third Napoli goal.,16526,0.99,380,Chelseatilidie,2023-12-16 19:18:08,https://v.redd.it/2zmzlmjoip6c1,False,False
tjawds,Passionate young FC Köln fan at the match against Borussia Dortmund,16530,0.99,272,CMSES,2022-03-21 12:40:04,https://v.redd.it/18a9qzt2fqo81,False,False
xyztzl,Oliver Kahn reaction to Dortmunds 2nd goal.,16521,0.99,369,Sal21G,2022-10-08 18:25:47,https://v.redd.it/gkpryd77kms91,False,False
ztiscf,Throwback video of Maradona and Pelé having a header rally on live TV,16508,0.98,749,niallw1997,2022-12-23 15:12:49,https://v.redd.it/exz0yxzlgp7a1,False,False
