id,title,score,upvote_ratio,num_comments,author,created_utc,url,over_18,edited
fx1ovx,"On this day 10 years ago, Arjen Robben made this wonderstrike against Manchester United to send FC Bayern to the Semi-finale of the Champions League. (Manchester United vs FC Bayern 3-2).",15571,0.94,479,Qytil,2020-04-08 07:03:15,https://v.redd.it/m2kxn0ldljr41,False,False
ao9lcl,Emiliano Sala body identified after being recovered yesterday,15570,0.95,813,Boucot,2019-02-07 22:36:40,https://www.lequipe.fr/Football/Actualites/Le-corps-repeche-est-celui-d-emiliano-sala/986506,False,False
fn6o48,Liverpool and Scotland footballer Andy Robertson 'is the mystery backer behind huge donation that kept SIX food banks in Glasgow going' amid the ongoing coronavirus crisis,15562,0.95,364,foundeverywhere,2020-03-22 20:33:39,https://www.dailymail.co.uk/sport/sportsnews/article-8139761/Andy-Robertson-thought-player-donation-kept-SIX-food-banks-Glasgow-going.html,False,False
bq5pyt,Kovac didn't see Robben coming,15573,0.96,474,josbez,2019-05-18 16:18:22,https://gfycat.com/DaringTastyAngelwingmussel,False,False
ezk5a7,"Cristiano Ronaldo interview: “As a child, I thought that at 35, I would be a fisherman in Madeira. I never dreamed of playing what I played, winning what I won.”",15566,0.96,840,JeebaRock,2020-02-06 01:07:45,https://www.abola.pt/Internacional/2020-02-05/juventus-onde-pensava-estar-aos-35-anos-a-pescar-na-madeira/827924,False,False
ntp1k3,"[Adam Crafton] Blows my mind that Marcus Rashford, who literally ensured children are being fed in some of the poorest parts of the north east, is wearing captain’s armband, leading players in taking the knee, and paying supporters are still booing his act.",15553,0.88,444,None,2021-06-06 16:05:15,https://twitter.com/adamcrafton_/status/1401570423318450184?s=21,False,False
ghu6mp,"Danny Rose on return to football: ""The governments saying bring back football to boost the morale of the nation, I don't give a f*ck about the nations morale. Peoples lives are at risk! Football shouldn't be spoken about till numbers have dropped massively. It's bollocks.""",15538,0.9,1335,SenorButtmunch,2020-05-11 19:09:35,https://twitter.com/thespursweb/status/1259911056278925313?s=21,False,False
1dwu4d6,Pepe's reaction when a Portuguese journalist thanks the defender for everything he's done for the country,15536,0.99,462,oklolzzzzs,2024-07-06 16:56:33,https://v.redd.it/5iqd3b6hixad1,False,False
bwyum6,"Mohamed Salah on Twitter ""Whats happening from some journalists and some people(gathering in front of his house at his home town) that i can't get out to Eid prayer has nothing to do with love. It's called disrespecting privacy and unprofessionalism",15523,0.93,1036,Migostien,2019-06-05 05:09:25,https://twitter.com/MoSalah/status/1136114818782547968,False,False
owhyvz,"2 years ago after getting 5-0'd by Flamengo, Renato Gaúcho said ""Their squad is worth 200 million, give me a 200 million squad and you'll see how its easy"". Now he's Flamengo's manager and this is his first 6 results with the 200 million squad",15521,0.99,707,gonnj,2021-08-02 16:21:51,https://i.redd.it/o9nw7ld70ze71.png,False,False
4brd1w,Johan Cruijff has died at age 68,15500,0.87,1490,blx666,2016-03-24 12:35:28,https://twitter.com/VI_nl/status/712980581672427520,False,False
k9c4uv,Barcelona 0-2 Juventus: McKennie goal,15500,0.96,1333,TomasRoncero,2020-12-08 20:21:00,https://streamable.com/dmuit2,False,False
jv6zxt,Algeria [2] - [0] Zimbabwe. Riyadh Mahrez (Great goal),15491,0.98,533,just_101,2020-11-16 13:47:37,https://v.redd.it/ud697rdlwlz51,False,False
ufulvp,Two children accidentally running into each other in front of Nacho Fernandez,15491,0.98,218,RevertBackwards,2022-05-01 07:27:03,https://v.redd.it/8dz6eetkgtw81,False,False
pdwrli,"[OptaJoe] 1 - For the first time in top-flight history, Tottenham Hotspur will end the day top at the same time as Arsenal ending the day bottom of the table. Parallel.",15488,0.95,799,None,2021-08-29 14:58:20,https://twitter.com/OptaJoe/status/1431993267348987906?s=19,False,False
8fav0t,Riley McGree fantastic goal against Melbourne City,15481,0.95,683,t1nk0,2018-04-27 11:17:33,https://streamable.com/cin1r,False,False
g1q903,"5 years ago today, Luis Suarez nutmegged David Luiz on 2 separate goals as Barcelona beat PSG in the first leg of the UCL quarterfinals",15477,0.95,864,MagyarFoci29,2020-04-15 11:35:37,https://v.redd.it/zuvfurh4xys41,False,False
eezq59,"Stan Kroenke owns most valuable sports empire, still doesn’t pay Arsenal contract staff a living wage in London.",15455,0.94,1499,JetSpyda,2019-12-24 10:30:48,https://twitter.com/laythy29/status/1207616128031301632?s=21,False,False
kd93s1,"[BRASILEIRÃO] Two of the biggest clubs in the country, São Paulo and Corinthians, faced each other yesterday. This happened. I have no words.",15459,0.98,370,idontlikeflamingos,2020-12-14 23:14:11,https://v.redd.it/g0n0gndvi8561,False,False
4nidid,Payet scores vs Romania to make it 2-1 to France,15460,0.87,1469,FredSports,2016-06-10 20:48:52,https://streamable.com/grxh,False,False
hd9vwf,Aston Villa 1-[1] Chelsea: Christian Pulisic goal 60',15453,0.85,1180,TomasRoncero,2020-06-21 16:36:12,https://www.clippituser.tv/c/xrmaev,False,False
8n55l2,Lego Version of the Champions League Final,15453,0.93,302,WankyVoldemort,2018-05-30 02:54:46,https://v.redd.it/gctbyrwtqw011,False,False
j6n5r4,"Liverpool star Salah praised after stopping abuse of homeless man - “He heard what a group of lads were saying to me, then turned to them and said, ‘That could be you in a few years’. I only knew I wasn’t hallucinating when Mo incredibly handed me £100.""",15439,0.97,729,Sumit316,2020-10-07 08:22:01,https://www.goal.com/en/news/real-life-hero-liverpool-star-salah-praised-after-stopping-abuse-/191xziltnafq11h1wgb81ls8xr,False,False
goisss,40 year old assistant manager of Odense Boldklub just subbed on against FC Copenhagen and did this,15433,0.98,299,phillydk,2020-05-22 12:52:56,https://v.redd.it/p4bqxuckcb051,False,False
v3w1id,"OTD 25 years ago, Roberto Carlos scored a spectacular long-range free kick against France.",15422,0.99,589,SunnySimantov,2022-06-03 10:03:42,https://v.redd.it/cx9d1z1pqd391,False,False
7oxr1p,"Ex-Arsenal star Lukas Podolski opens kebab shop in Cologne, 1,000 people attend opening",15421,0.93,801,Utegenthal,2018-01-08 10:43:08,https://www.fourfourtwo.com/features/ex-arsenal-star-lukas-podolski-opens-kebab-shop-cologne-1000-people-attend-opening,False,False
31fof0,Adam goal against Chelsea,15401,0.92,1181,Fusir,2015-04-04 17:15:36,http://gfycat.com/GeneralAptAfricanmolesnake,False,False
zp9w8k,Lionel Messi being carried on Sergio Aguero's shoulders whilst lifting the World Cup trophy,15386,0.97,402,OleoleCholoSimeone,2022-12-18 22:10:36,https://v.redd.it/5z9gkmawcq6a1,False,False
qly6dp,"Gomez attacks Kimmich on live TV: ""The stadiums are full because 60, 70, 80 percent of people are vaccinated to have. He also benefits from that. If everyone would react like him, then we would probably play another year without an audience.""",15369,0.93,382,Flamengo81-19,2021-11-03 16:26:10,https://www.bild.de/sport/fussball/fussball/fc-bayern-muenchen-mario-gomez-geht-im-tv-auf-joshua-kimmich-los-78135628.bild.html,False,False
eeksg7,Cristiano Ronaldo (554) and Lionel Messi (579) are the only two players that scored 400+ goals this decade.,15356,0.96,1245,Nouri34ever,2019-12-23 13:45:47,https://www.reddit.com/r/soccer/comments/eeksg7/cristiano_ronaldo_554_and_lionel_messi_579_are/,False,False
1gcupb2,Kylian Mbappe was caught offside 8 times in El Classico,15343,0.99,716,Rayan2550,2024-10-26 20:55:53,https://i.redd.it/6r8a3buaz5xd1.jpeg,False,False
t84xn7,João Cancelo attempted bicycle kick against Man Utd 82' + Pep's reaction,15337,0.95,414,MindMaster115,2022-03-06 18:25:42,https://v.redd.it/r27lbksw2tl81,False,False
bo3not,"Eden Hazard joins Real Madrid for 100M Euros, will make it official after Europa League Final [L'Equipe]",15338,0.93,1629,juanbatata,2019-05-13 13:44:31,https://www.lequipe.fr/Football/Article/Eden-hazard-chelsea-debarque-au-real-madrid/1018385,False,False
vf6ztq,[Martijn Debbaut] Nutmegged Entire Squad,15321,0.98,315,None,2022-06-18 14:07:24,https://v.redd.it/werdkreuzd691,False,False
lgs2it,[Harris]Devastating news for Jurgen Klopp with his mother Elisabeth dying at the age of 81 and he won't be able to travel to Germany for the funeral due to pandemic-related travel issues.,15315,0.98,849,Surprise147,2021-02-10 11:52:54,https://twitter.com/RobHarris/status/1359469480083087361?s=20,False,False
kbzvgn,Welcome to the A-League,15322,0.99,704,Dickinbae,2020-12-12 23:51:55,https://v.redd.it/acputp27gu461,True,False
dqmwvu,Aston Villa 1-[2] Liverpool: Mane 90+4',15313,0.84,2169,ennuihenry15,2019-11-02 16:57:17,https://streamvi.com/watch.php?video=1572713813,False,False
1gee3gn,[Ballon D'or] Rodri wins Ballon D'or 2024,15311,0.87,3377,Snitor,2024-10-28 21:44:07,https://x.com/ballondor/status/1851017073666720134,False,False
m5gtua,Aiden McGeady’s pass to take out six players & set up the winning goal.,15302,0.99,488,Traffodil,2021-03-15 09:23:23,https://v.redd.it/mbcf1qj0u5n61,False,False
64lbfh,"Official: Canada, USA and Mexico declare intention to submit unified bid for 2026 FIFA World Cup",15305,0.91,2653,deception42,2017-04-10 18:18:19,http://www.canadasoccer.com/2026-fifa-world-cup-canada-usa-and-mexico-declare-intention-to-submit-unified-bid-p160713-preview-1,False,False
8xsqkw,[Lapanje] Next thing they should add to modernise football is to change stoppage time to effective time. Today 6 minutes was added but the ball was in play for maybe 2-3 minutes. Yet the referee blew at almost exactly 96'. Heavily encourages time-wasting. Same story in most games I watch.,15291,0.94,1691,GilsWorld,2018-07-10 20:01:20,https://twitter.com/Hashtag_Boras/status/1016773528123854848,False,False
12vghie,[Wrexham AFC] are promoted back to the Football League after 15 years,15284,0.97,1193,deception42,2023-04-22 19:28:56,https://twitter.com/Wrexham_AFC/status/1649857050589970435,False,False
l36jjy,Some old Nepalese women enjoying a penalty shoot-out. Football truly is a beautiful game.,15283,0.98,350,NishekRedDevil,2021-01-23 06:03:07,https://v.redd.it/omy035rnv0d61,False,False
11mzlo6,Sergio Ramos caught on cameras allegedly saying: “F*ck the wh*re that gave birth to Paris. Motherf****r”,15270,0.96,1278,II_MrBlack_II,2023-03-09 18:25:25,https://v.redd.it/hs1r99imarma1,False,False
i3hfh9,Iker Casillas retires from professional football.,15266,0.99,498,SmokiestElfo,2020-08-04 11:12:31,https://twitter.com/IkerCasillas/status/1290604618205073410,False,False
u84sn3,Allan Saint-Maximin dance moves against Crystal Palace,15269,0.98,449,J7isTheGoat,2022-04-20 19:47:17,https://v.redd.it/1xgpkwbwmqu81,False,False
qudw6i,"Dying for the World Cup: Large numbers of healthy young men building stadiums in Qatar are returning home with kidney diseases so severe that transplant or dialysis is needed. In Nepal, a fifth of dialysis patients are migrant workers returning from the host nation and cases are rapidly increasing.",15261,0.98,1234,Convenient_Amnesia,2021-11-15 10:57:22,https://www.thetimes.co.uk/article/qatar-2022-dying-for-the-world-cup-r3kh38qnd,False,False
mt9zvf,"Birmingham and Coventry share the same stadium, same sponsor, same games played, same games won, same games drawn, same games lost, same goal difference and same points.",15250,0.99,443,Cultural-Customer,2021-04-18 10:00:54,https://i.redd.it/7j07rrsqnwt61.png,False,False
n73rgd,"[Sid Lowe] Seeing a lot of Hazard compared to Bale stuff and, well, y’know... Hazard has put the ball in the net four times for Real Madrid. Bale has put the ball in the net four times for Real Madrid in European Cup finals.",15236,0.97,1391,ronnieboy_7,2021-05-07 17:19:59,https://twitter.com/sidlowe/status/1390207657609465859,False,False
8v29nt,Ángel Di María Goal (France 1-[1] Argentina),15222,0.94,1114,penguin672232,2018-06-30 14:41:05,https://streamja.com/NVPX,False,False
18jw2oh,Roy Hodgson chuckling at Pep,15228,0.99,313,RevertBackwards,2023-12-16 17:29:32,https://v.redd.it/sjwy4fxazo6c1,False,False
ul2v5e,Sam Kerr (Chelsea W) outrageous volley against Manchester United,15217,0.94,483,rubes___,2022-05-08 14:26:36,https://v.redd.it/f5tisbi3i9y81,False,False
139ho1p,"[Daily Mail] Jack Grealish on Erling Haaland: ""He's the best professional I've seen. Recovers. In the gym. 10 hours of treatment a day. Ice baths. Diet. I swear I couldn't be like that. After a game, he say: 'Hey. Don't go out tonight partying'. I just tell him to shut up & go sit in his ice bath.""",15216,0.98,754,TheBiasedSportsLover,2023-05-06 09:12:09,https://www.dailymail.co.uk/sport/football/article-12051511/Jack-Grealish-face-Gucci-100m-City-maverick-loves-joke-Haaland.html?ito=social-twitter_dailymailsport,False,False
5gfur0,Goal line technology used in the Bournemouth - Liverpool match. Down to millimetres.,15212,0.93,1048,None,2016-12-04 15:21:07,https://gfycat.com/AstonishingScentedAsiaticgreaterfreshwaterclam,False,False
bkaukv,"Joe Lolley after winning Nottingham Forest's Player of the Season Award: ""Would also like to sincerely say thank you to absolutely none of my team mates, as this is an individual award, losers.""",15197,0.97,316,DriesMertens,2019-05-03 17:07:03,https://twitter.com/JLolley23/status/1124349124197928960,False,False
mdmenm,"Thierry Henry: ""Hi Guys. From tomorrow morning I will be removing myself from social media until the people in power are able to regulate their platforms with the same vigour and ferocity that they currently do when you infringe copyright...",15189,0.96,1172,None,2021-03-26 11:21:22,https://www.instagram.com/p/CM4Tqj7l7W7/?igshid=1io1v4i23mo77,False,False
mwuuyp,[Simon Stone] Pep says maybe the year should be extended to 400 days to fit the extra matches in his players will have to play in new CL format.,15181,0.99,619,zSolaris,2021-04-23 13:07:45,https://twitter.com/sistoney67/status/1385572821485633539,False,False
n2scmt,Harry Wilson insane goal vs Birmingham,15184,0.98,278,Harvey-knibbs,2021-05-01 21:48:26,https://v.redd.it/rfg4p01qxkw61,False,False
nh3nai,Tottenham fans fume at Daniel Levy and owners ENIC for putting returning fans in the upper tier in order to keep sponsorship banners next to pitch... while charging them £60 for the privilege - the most expensive of any team in the Premier League,15166,0.99,950,Lolastic_,2021-05-20 15:46:54,https://www.dailymail.co.uk/sport/football/article-9599565/Tottenham-fans-SLAM-Daniel-Levy-owners-ENIC-decision-returning-fans-upper-tier.html,False,False
hy5lnm,Wolves lubricate Adama Traore's arms with baby oil to make it harder for opponents to grab his arms,15175,0.99,599,Nouri34ever,2020-07-26 11:46:36,https://www.voetbalzone.nl/doc.asp?uid=374816,False,False
wh04ry,"La Liga have rejected Barcelona's attempts to register 5 summer signings (Lewandowski, Kounde, Raphinha, Kessie, Christensen) and 2 contract renewals (Dembele, S Roberto). Club must raise more funds before league campaign gets underway in 8 days.",15135,0.98,2038,None,2022-08-05 16:42:07,https://www.mirror.co.uk/sport/football/transfer-news/frenkie-dejong-barcelona-man-united-27670700,False,False
t49cph,"Tuchel, having repeated his comments about the horror of war and focusing on sports, finally gets exasperated by questions about Abramovich/the situation in Ukraine: ""You have to stop, I'm not a politician... You have to stop asking me these questions, I have no answers for you.""",15127,0.98,1159,AstronautRadiant8586,2022-03-01 14:38:37,https://v.redd.it/qokayd55ask81,False,False
caydas,Someone has broken into Daniel Sturridge's LA Home and taken his dog,15123,0.93,1180,ThatRedditerGuy,2019-07-09 09:03:45,https://www.instagram.com/p/BzsIQLHg6jW/?igshid=10fzm6vz88eka,False,False
u0mhxq,Guardiola and Klopp at Full-Time [Great handshake],15119,0.97,596,_cumblast_,2022-04-10 17:32:24,https://streamable.com/tjtjod,False,False
tjgu6x,"Rafa Silva ""Puskás worthy"" goal from yesterday (multiple angles)",15117,0.96,532,None,2022-03-21 17:16:37,https://v.redd.it/ie7x3q6csro81,False,False
w7n05w,Neymar Jr dive against Osaka - 30’ PSG 1 - 0 Osaka,15112,0.92,2087,Hot-Protection4548,2022-07-25 11:55:15,https://v.redd.it/lmsr3evpvqd91,False,False
1gern69,"[OneFootball] Sergio Agüero: “Football is for everyone, not just Real Madrid. They are so entitled.”",15111,0.92,1080,captaincourageous316,2024-10-29 10:49:49,https://x.com/OneFootball/status/1851202326020964370,False,False
kcip1t,[Talksport] Pierre-Emerick Aubameyang has scored more goals against Arsenal than he has for Arsenal at the Emirates this season,15111,0.98,712,wrdb2007,2020-12-13 21:01:03,https://twitter.com/talkSPORT/status/1338225408853110786,False,False
o70r1a,[OFFICIAL] UEFA has abolished the away goals rule,15109,0.97,2500,None,2021-06-24 13:21:29,https://www.uefa.com/insideuefa/mediaservices/mediareleases/news/026a-1298aeb73a7a-5b64cb68d920-1000--abolition-of-the-away-goals-rule-in-all-uefa-club-competitions/,False,False
10sruqg,"Sergio Ramos: ""There was suffering for several years playing against Messi. I am now enjoying him. He is the best player football has ever produced.""",15091,0.97,1126,doksich,2023-02-03 18:47:16,https://www.goal.com/en/news/sergio-ramos-glad-the-lionel-messi-suffering-is-over/blt9e1c28866e370ae1,False,False
g48m03,"Wayne Rooney: The US sports trade system is well suited to other American leagues such as the NBA and NFL, but players in MLS do not earn enough for the system to be fair. MLS owners are taking advantage of the league structure, which is affecting American players.",15084,0.95,1244,A-Dumb-Ass,2020-04-19 14:32:27,https://www.espn.com/soccer/major-league-soccer/story/4086776/rooney-mls-owners-taking-advantage-us-players,False,False
iodna8,Comunicado oficial : Everton sign James Rodríguez,15067,0.99,860,IGuessIRanOutOfFecks,2020-09-07 19:00:22,https://www.realmadrid.com/noticias/2020/09/07/comunicado-oficial-james-rodriguez,False,False
bgk3o4,Watford 0 - [1] Southampton - Shane Long 1',15068,0.92,942,matixrr,2019-04-23 18:49:22,https://streamable.com/1i6cj,False,False
e70gqy,Leicester City's defensive statistics this season,15057,0.96,992,Beechey,2019-12-06 15:50:41,https://i.redd.it/r9ib3dhab1341.jpg,False,False
oibyj9,Italy [1] - 1 England - Leonardo Bonucci 67',15042,0.93,1168,alexinup,2021-07-11 20:26:48,https://streamye.com/v9jgA89,False,False
jeo5km,"[SER] Osama VinLaden (Peruvian 2nd Division player): I thought about changing my name but now I like it, it was fashionable in its day. My brother's name is Saddam Hussein and my father wanted to name the third child George Bush, but it was a girl.",15045,0.99,871,None,2020-10-20 12:06:08,https://twitter.com/quethijugues/status/1318519037006123009?s=21,False,False
ijdhtk,[Martinez] Lionel Messi has asked the club twice for a friendly exit and wants an agreement with Barcelona. He doesn’t want to face a lawsuit against the club he loves.,15044,0.99,1220,Austin63867,2020-08-30 14:27:09,https://twitter.com/Alfremartinezz/status/1300075846758207489?s=19,False,False
dsn82g,Kyle Walker saves a free kick vs. Atalanta,15034,0.93,732,smoltanboi,2019-11-06 21:49:42,https://streamable.com/uey4x,False,False
bbqnxp,"Ajax [1]-1 Juventus, Neres 46'",15029,0.92,691,Snooooked,2019-04-10 20:04:48,https://streamable.com/e3ioy,False,False
zp4a0x,[Squakwa] No player in the 92-year history of the World Cup has scored more goals in the Final than Kylian Mbappé (4).,15023,0.95,1304,keithohara,2022-12-18 18:02:53,https://twitter.com/squawka/status/1604521574786166784?s=61&t=ESSQhM0nrYMvzEGQiOPYNw,False,False
frv9oi,"Van Persie : ""We lost against City in april and we were still 12 points ahead. Two players went to a party the night after the match. Next day, Ferguson stuck pics from this party on the walls and said ""if we lose the title, it's because of these two assholes"". """,15015,0.96,740,paicmhsc,2020-03-30 17:37:34,https://www.sofoot.com/robin-van-persie-j-avais-signe-a-manchester-pour-sir-alex-ferguson-481480.html,False,False
4jgnfd,"Arsenal have finished 2nd, & they have finished above Tottenham for the 21st consecutive season",15001,0.79,2155,mx_code,2016-05-15 15:53:23,https://twitter.com/SkySportsStatto/status/731874736247078912,False,False
ohvn6a,The moment Lionel Messi and Argentina became Copa America winners.,14996,0.96,621,GuestBadge,2021-07-11 01:58:36,https://v.redd.it/r34xj2y5qha71,False,False
1030pdt,Lionel Messi given a guard of honour by his PSG team-mates,14980,0.95,600,Blu-10,2023-01-04 10:54:42,https://v.redd.it/bmqrjl3cb0aa1,False,False
nn4nxc,[Barack Obama] .@MarcusRashford is way ahead of where I was at 23—and not just because he’s a better athlete. It was great talking with him about everything from our shared love of reading to how we can lift up the next generation of leaders.,14977,0.92,1040,Redaaku,2021-05-28 18:46:17,https://twitter.com/BarackObama/status/1398345940315086854?s=19,False,False
dzzv1h,"[Gazzetta] Conte: ""I explain to the players how they should have sex ... in the periods of competition, the intercourse should not last long and they should be on the bottom.""",14974,0.95,795,DrummerVim,2019-11-22 11:42:36,https://www.gazzetta.it/Calcio/Serie-A/Inter/22-11-2019/conte-all-equipe-non-sono-leccaculo-prima-una-gara-sesso-veloce-3501292860042.shtml,False,False
b6ve8y,Harry Kane: I will walk England team off pitch if players face more racism,14974,0.94,1304,JOLLHURN,2019-03-29 10:05:43,https://www.telegraph.co.uk/football/2019/03/28/harrykane-will-walk-england-team-pitch-players-face-racism/,False,False
nycf0w,"[MicGWagner]Finland fans chanting ""Christian"", while Denmark fans chant ""Eriksen"". ❤",14969,0.99,376,makban234,2021-06-12 17:58:33,https://twitter.com/MicGWagner/status/1403770674569748481?s=19,False,False
6pt2aa,Jozy Altidore (USA) goal against Jamaica [1-0],14969,0.84,884,Fusir,2017-07-27 02:35:29,https://streamable.com/fyknd,False,False
ypm0k3,Valverde's shot against Rayo from the POV of the neighbour's balcony,14966,0.99,241,boxro,2022-11-08 13:20:24,https://v.redd.it/fzts444j9qy91,False,False
9wzdsr,"N'Golo Kanté refused to be paid in a tax haven, despite Chelsea's insistence. ""N'Golo is inflexible: he just wants a normal salary""",14965,0.96,778,None,2018-11-14 11:45:42,https://www.mediapart.fr/journal/international/141118/n-golo-kante-le-joueur-qui-ne-voulait-pas-etre-paye-jersey,False,False
muws0h,[talkSPORT] BREAKING: All 12 clubs are meeting tonight to discuss disbanding the Super League. - talkSPORT sources understand.,14964,0.99,1887,andiirehan,2021-04-20 18:21:10,https://twitter.com/talkSPORT/status/1384572320346382336,False,False
npqqtd,"Sergio Aguero bought every member of staff at Man City's first-team building - of which there are more than 60 - either a Hublot or Tag Heuer watch, each engraved with the words ""Gracias! Kun Aguero"". As well as raffle tickets to win his cars.",14952,0.98,643,Good_Kev_M-A-N_City,2021-06-01 10:23:21,https://theathletic.com/2625012/2021/06/01/revealed-sergio-agueros-leaving-gifts-to-manchester-city-staff-included-watches-and-raffle-tickets-to-win-his-car/,False,False
xtpi7n,Man Utd fans leaving the Ethiad before the end of the first half.,14952,0.98,698,keithohara,2022-10-02 13:59:00,https://v.redd.it/sx6a3q66fer91,False,False
y93fdn,Club statement - Ronaldo will not be in the squad for the Chelsea game,14952,0.98,2490,untradablecrespo,2022-10-20 16:50:58,https://www.manutd.com/en/news/detail/man-utd-club-statement-on-cristiano-ronaldo-following-tottenham-match?,False,False
1dpnj5q,Kvaratskhelia went straight to Ronaldo before joining his teammates for celebration after the match against Portugal,14947,0.98,425,whiteniteee,2024-06-27 09:57:09,https://v.redd.it/h5wi846h739d1,False,False
6t8stw,Everton 1-0 Stoke City - Rooney 45'+1',14952,0.9,659,HerbalDreamin,2017-08-12 14:46:28,https://www.clippituser.tv/c/ayqbvd,False,False
ecbszl,Arsenal star Mesut Ozil removed from Pro Evolution Soccer in China.,14947,0.96,1419,None,2019-12-18 12:11:28,https://www.standard.co.uk/sport/football/arsenal-mesut-ozil-pro-evolution-soccer-china-a4316616.html?utm_medium=Social&utm_source=Twitter#Echobox=1576670197,False,False
11181zv,[Jakub Jankto] Czechia and Sparta Prague midfielder Jakub Jankto comes out as gay.,14941,0.93,980,YadMot,2023-02-13 13:19:28,https://twitter.com/jakubjanktojr/status/1625117590182928384,False,False
8sigcs,Pepe over reacting vs Morocco,14932,0.93,1979,goonerlenny,2018-06-20 13:50:09,https://streamja.com/kq4A,False,False
1d7a41l,"Comunicado Oficial: Kylian Mbappé
",14916,0.94,1920,Real_Inigo_Montoya,2024-06-03 17:27:32,https://www.realmadrid.com/es-ES/noticias/futbol/primer-equipo/actualidad/comunicado-oficial-mbappe-03-06-2024,False,False
wcvhko,[Lionesses]:England's women national team wins EURO 2022,14916,0.91,2101,Nervous-Resolution-8,2022-07-31 18:32:47,https://twitter.com/Lionesses/status/1553810862925832194?cxt=HHwWhICzzeqvn5ArAAAA,False,False
hgv5x1,FC Groningen sign Arjen Robben,14911,0.99,698,None,2020-06-27 15:09:30,https://twitter.com/fcgroningen/status/1276894304342904832,False,False
cuv2ex,Manchester United 1-[2] Crystal Palace : Van Aanholt 90+3',14908,0.89,1568,paicmhsc,2019-08-24 15:52:53,https://www.reddit.com/r/soccer/comments/cuv2ex/manchester_united_12_crystal_palace_van_aanholt/,False,False
fj7e2c,The Ox has a way of passing the time during the football hiatus,14904,0.93,563,None,2020-03-15 19:55:57,https://v.redd.it/k05s3fzarum41,False,False
haw6z5,Sheffield United goal not given vs. Aston Villa,14903,0.94,1582,TomasRoncero,2020-06-17 17:46:06,https://www.clippituser.tv/c/paevwp,False,False
