id,title,score,upvote_ratio,num_comments,author,created_utc,url,over_18,edited
4hjqun,Leicester City Are Premier League Champions,76064,0.89,10112,m3ridah,2016-05-02 20:55:45,https://twitter.com/LCFC/status/727240110920577024,False,False
zuvdho,Petition to rename the subreddit to r/football,71377,0.84,898,dead_blaze3271,2022-12-25 10:09:51,https://www.reddit.com/r/soccer/comments/zuvdho/petition_to_rename_the_subreddit_to_rfootball/,False,False
evljch,Alassane Plea (Gladbach) scores a volley with his standing foot while faking a shot with his other foot,62112,0.96,989,mattzaliar,2020-01-29 11:12:55,https://v.redd.it/l3gijf3qapd41,False,False
fjtfnk,Italy [1]-0 Finland - Donkey Kong 1’,60622,0.95,1295,11AB,2020-03-16 22:06:44,https://streamable.com/hwa6l,False,False
8tcgyq,Kroos goal vs Sweden [2]-1 Free kick,59778,0.9,5647,spoonfedsam,2018-06-23 19:53:35,https://www.clippituser.tv/c/kaqqxn,False,False
oynqqa,[FC Barcelona] Messi will not renew with FC Barcelona,59118,0.98,8841,SuperBros697,2021-08-05 17:50:20,https://www.fcbarcelona.es/es/futbol/primer-equipo/noticias/2207655/leo-messi-no-seguira-ligado-al-fc-barcelona,False,False
89hyek,Juventus 0-2 Real Madrid - Cristiano Ronaldo 64' (Champions League - Quarter-finals),51989,0.91,3975,gemifra,2018-04-03 20:05:59,https://streamable.com/ai0yd,False,False
zp43wc,Argentina have won their third World Cup title at the 2022 FIFA World Cup in Qatar!,50377,0.94,9312,HancokUndead,2022-12-18 17:54:53,http://www.fifa.com/fifaplus/en/match-centre/match/17/255711/285077/400128145,False,False
zyd520,"Pelé, Brazil’s mighty king of ‘beautiful game,’ has died",49871,0.98,3065,jt_ftc_8942,2022-12-29 18:57:02,https://apnews.com/article/f2c5f7d2771b96dbd854cb025ab2563a,False,False
8mcpf4,Real Madrid [2]-1 Liverpool : Bale 64' (Champions League final),49628,0.89,3222,paicmhsc,2018-05-26 20:08:29,https://streamja.com/zP6a,False,False
oidg3u,[Italy] have won the UEFA EURO 2020,47541,0.89,10525,BVB-Oeli,2021-07-11 21:54:19,https://twitter.com/Vivo_Azzurro/status/1414342246586101760,False,False
8xq9dn,Juventus Signs Cristiano Ronaldo,46885,0.91,5840,TomasRoncero,2018-07-10 15:33:32,https://www.realmadrid.com/noticias/2018/07/comunicado-oficial-cristiano-ronaldo,False,False
d18nmj,"A guy saves his girlfriend from being hit with a ball from a free kick, with a header.",46443,0.96,944,just_a_random_guy_11,2019-09-08 09:04:23,https://v.redd.it/snwqovom5cl31,False,False
k0uzsv,Maradona passed away at the age of 60,44512,0.98,4586,None,2020-11-25 16:12:47,https://www.clarin.com/deportes/diego-armando-maradona-sufrio-paro-respiratorio-grave_0_hCcpbyiC-.html,False,False
fdaoij,"Jurgen Klopp: “I don’t understand politics, I don’t understand the coronavirus. Why ask me? All I do is wear a baseball cap and a patchy beard. Celebrities shouldn’t speak on these serious issues. Leave it to the experts.”",44162,0.92,1376,JeebaRock,2020-03-04 09:38:54,https://www.abola.pt/Internacional/2020-03-04/liverpool-pergunta-sobre-coronavirus-irrita-klopp-uso-um-bone-de-beisebol-e-ten/832155,False,False
pcq1c9,United confirm Ronaldo agreement,43664,0.95,4335,AlphaStryk3r,2021-08-27 15:52:05,https://www.manutd.com/en/news/detail/official-statement-on-agreement-reached-for-cristiano-ronaldo?utm_campaign=ManUtd&utm_medium=post&utm_source=twitter,False,False
88lhw5,Zlatan Ibrahimovic (LA Galaxy) goal against LAFC [3]-3,42977,0.93,2085,Fusir,2018-03-31 20:39:23,https://streamable.com/wp3oo,False,False
8rds22,Portugal [3]-3 Spain - Ronado (Hat-Trick) 87' [2018 FIFA World Cup],42642,0.9,4040,HerbalDreamin,2018-06-15 19:45:10,https://www.clippituser.tv/c/ellrgq,False,False
zp5dqq,Messi reaction to Montiel’s penalty.,41936,0.96,1213,keithohara,2022-12-18 18:53:40,https://v.redd.it/wc6tabcgvq6a1,False,False
ef501y,Decade rewind,41931,0.92,2218,TheStangun,2019-12-24 18:20:28,https://v.redd.it/rrr9ulpdim641,False,False
mth0jz,Gary Neville's full reaction to the news of a potential super league,41802,0.98,2885,MUFColin,2021-04-18 17:16:37,https://streamable.com/n3zqnz,False,False
bjm7ry,Barcelona 3-0 Liverpool - Messi 82',41475,0.91,4653,HerbalDreamin,2019-05-01 20:43:59,https://www.clippituser.tv/c/dnbaba,False,False
6f2xxh,Juventus 1-1 Real Madrid ( Mandzukic M. 27'),41206,0.89,1500,PradaBoyDave,2017-06-03 19:15:06,https://my.mixtape.moe/elslxn.mp4,False,False
af9lvk,PSA - The Sun will now be a banned source on this subreddit.,40432,0.9,2754,Thesolly180,2019-01-12 17:38:21,https://www.reddit.com/r/soccer/comments/af9lvk/psa_the_sun_will_now_be_a_banned_source_on_this/,False,False
hco3p2,Ceballos and the greatest nutmeg you'll ever see,40260,0.95,525,mmalgastar,2020-06-20 15:27:10,https://v.redd.it/4wg8m8il23651,False,False
cx3p4a,"Representatives from Slavia Praha (CZE) Laughing in Response to being drawn in group with Barcelona, Inter Milan, and Borussia Dortmund [group F]",39561,0.95,1223,foxinyourbox,2019-08-29 17:03:54,https://v.redd.it/ekbnjg2u5fj31,False,False
d26r99,Marcelo visited his son's school and did the bin challenge with the kids,38620,0.96,521,just_a_random_guy_11,2019-09-10 12:20:25,https://v.redd.it/8tps2djeerl31,False,False
8ytfgu,"Harry Kane's ""miss"" was actually a world-class save by Subašić",38585,0.92,855,None,2018-07-14 13:57:15,https://v.redd.it/6wkff2qf5x911,False,False
fikja1,I've got it. I know how we save the 2019/2020 Premier League.,38566,0.94,821,CaptEduardoDelMango,2020-03-14 15:59:20,https://www.reddit.com/r/soccer/comments/fikja1/ive_got_it_i_know_how_we_save_the_20192020/,False,False
8z32ph,France win the 2018 FIFA World Cup.,38391,0.81,4631,keithohara,2018-07-15 16:53:51,https://www.fifa.com/worldcup/matches/match/300331552,False,False
o9u6sh,[Euro2020] Switzerland defeat the current world champions France 5-4 on penalties and qualify to the quarter-finals awaiting Spain,38300,0.98,4695,BastianMobile,2021-06-28 21:45:56,https://twitter.com/EURO2020/status/1409629120246525954,False,False
r3h19n,Wolfsburg fan reaction after Haaland does the pointing celebration towards him,38232,0.99,691,Fati25,2021-11-27 16:29:39,https://v.redd.it/t12oiuod06281,False,False
7w7i48,"Di María: ""Memes hurt us a lot, going to the psychologist helped me""",37940,0.9,2388,jacamacho,2018-02-08 19:42:31,http://www.marca.com/futbol/liga-francesa/2018/02/08/5a7c9b12468aeb4c608b462c.html,False,False
e7fmbd,Tottenham 3-0 Burnley: Son,37880,0.92,1984,ennuihenry15,2019-12-07 15:32:41,https://streamja.com/XNGX,False,False
z3tv2x,Brasil [2] - 0 Serbia - Richarlison 73’,37007,0.98,1941,Golovking,2022-11-24 20:30:53,https://dubz.co/v/w8vny5,False,False
ge6j2v,"Di Maria's wife ""I begged Angel, any place but England. And 1 year later we were in Manchester, a shithole""",36940,0.93,3513,None,2020-05-05 21:25:26,https://www.ole.com.ar/futbol-internacional/inglaterra/di-maria-manchester-united-esposa_0_WF621mm7y.html,False,False
dte45l,The german National Team won't play anymore in countries where women don't have equal rights and aren't allowed to visit football stadiums without discrimination.,36815,0.91,1072,NevenSuboticFanNo1,2019-11-08 11:26:28,https://twitter.com/ZDFsport/status/1192493072908730369?s=19,False,False
oci2r9,Immobile suddenly recovers when Italy scores,36564,0.97,2883,Surenas1,2021-07-02 19:59:07,https://v.redd.it/b769nawtuu871,False,False
blvvi5,Liverpool [4]-0 Barcelona : Origi 79' (agg. 4-3),36528,0.91,4407,paicmhsc,2019-05-07 20:38:46,https://streamja.com/bbOB,False,False
75lx0c,USA eliminated from world cup contention.,36477,0.89,11399,Erandir,2017-10-11 01:53:15,https://www.reddit.com/r/soccer/comments/75lx0c/usa_eliminated_from_world_cup_contention/,False,False
blphrc,"Vargas: ""I was raising money to flood victims & asked Messi for his shirt at kickoff, but forgot after the game. Exiting our room, he stood there with a little bag. ”Look, these are the shirts i collected for you” In it was his shirt, Xavi’s, Iniestas, Dani Alves, Pique & Puyols""",35940,0.95,667,FANTASY210,2019-05-07 11:22:19,https://www.mundodeportivo.com/futbol/fc-barcelona/20190506/462068685286/el-espectacular-gesto-de-messi-con-el-colombiano-vargas.html,False,False
8zdzmv,"After 6 hours on a bus driving through the crowd, Croatian soccer players arrive at the main square. Almost 15% (550k) of the entire population greeted them today.",35892,0.94,973,CroAtTheTop,2018-07-16 19:31:59,https://v.redd.it/aowus6vi3da11,False,False
7cqjmc,Italy have failed to qualify for the 2018 World Cup.,35226,0.91,4168,gutdias19,2017-11-13 21:42:04,https://twitter.com/Vivo_Azzurro/status/930188986064232454,False,False
nybzud,[Danish FA] Eriksen is awake and is undergoing further evaluation at the hospital,35038,0.99,1870,arne-b,2021-06-12 17:37:41,https://twitter.com/DBUfodbold/status/1403766834655080449?s=20,False,False
a79p3u,Manchester United has announced that Jose Mourinho has left the Club.,34954,0.93,4498,DarthBlatter,2018-12-18 09:48:37,https://twitter.com/ManUtd/status/1074964051741032448,False,False
8dm5c1,Arsene Wenger to step down at the end of the season.,34744,0.92,3292,DontEatTheChildren,2018-04-20 08:52:19,https://www.arsenal.com/news/merci-arsene,False,False
z11iwh,Grealish promises young fan a celebration for his next goal. Then delivers at the World Cup. Unreal stuff.,34657,0.98,776,conFmck,2022-11-21 15:20:03,https://v.redd.it/dhd2rafzmb1a1,False,False
aub8el,Kepa Arrizabalaga refuses to be subbed off and Maurizio Sarri is pissed about it,34530,0.93,4560,Meladroit40,2019-02-24 19:04:46,https://streamable.com/atpfq,False,False
zlkz2w,Beautiful message from interviewer to Messi after the match vs Croatia,34439,0.95,1293,Alexdd0007,2022-12-14 07:46:02,https://v.redd.it/y9apytq3jt5a1,False,False
8v2hhq,France [2]-2 Argentina - Pavard 57' [2018 World Cup],34276,0.94,2190,HerbalDreamin,2018-06-30 15:15:46,https://www.clippituser.tv/c/wxpvay,False,False
dwv23q,"Finland have qualified for Euro 2020, their first major international tournament",34138,0.94,1017,seanhemi,2019-11-15 18:49:13,https://www.uefa.com/european-qualifiers/match/2026099/,False,False
t7ceuj,Brandon Williams realizing it is Christian Eriksen pulling him down,33943,0.98,510,kennykip,2022-03-05 15:58:14,https://v.redd.it/oyxqs7hx7ll81,False,False
6rev48,Official: PSG signs Neymar,33473,0.84,4573,guisasolaa,2017-08-03 19:39:44,https://www.psg.fr/pro/article/neymar-jr-au-paris-saint-germain,False,False
zp5do1,Emi Martinez celebration for golden glove,33219,0.93,1376,GIGOLO_KANTE,2022-12-18 18:53:34,https://v.redd.it/1ejygz4qdp6a1,False,False
8xyu5z,Croatian firefighters before Rakitic penalty shooting against Russia,33110,0.94,863,CroAtTheTop,2018-07-11 11:41:30,https://v.redd.it/19pcxe2v2b911,False,False
5lfqpu,Giroud amazing goal vs Crystal Palace (1-0),32820,0.85,1652,notus_plus,2017-01-01 16:17:55,https://streamable.com/y51mb,False,False
c1zk2y,Former UEFA president Michel Platini has been arrested over the awarding of the 2022 World Cup.,32718,0.96,2665,Mukumber,2019-06-18 08:12:08,https://twitter.com/MailSport/status/1140894257533919232,False,False
5yaurn,Barcelona 6-1 Paris SG - Sergio Roberto 90'+5',32558,0.86,4335,gemifra,2017-03-08 21:43:59,https://u.nya.is/dmgqzl.mp4,False,False
bxkox0,Mesut Özil and his fiancé will celebrate their upcoming marriage by covering the expenses for the surgeries of over 1000 kids in need,32161,0.93,1060,stratrookie,2019-06-06 19:13:33,https://twitter.com/mesutozil1088/status/1136712201371361287?s=21,False,False
njgvum,[LOSC] Lille OSC have won the 2020-21 Ligue 1,32125,0.99,1158,EnigmaTR,2021-05-23 20:48:56,https://twitter.com/losclive/status/1396568821364887552,False,False
8xxwgi,"Help, Have you seen my Uncle?",32123,0.91,899,missbiscuitblues,2018-07-11 08:43:34,https://www.reddit.com/r/soccer/comments/8xxwgi/help_have_you_seen_my_uncle/,False,False
axqi6s,Real Madrid 1-[4] Ajax - Schöne 72' (3-5 agg.),32119,0.92,2149,HerbalDreamin,2019-03-05 21:30:59,https://www.clippituser.tv/c/qkvlqe,False,False
zp6q9g,Lionel Messi with his Man of the Match trophy.,32042,0.95,1285,stonycamacho,2022-12-18 19:53:31,https://i.imgur.com/LqGflBf.jpg,False,False
mtzy1f,"[Bruno Fernandes] ""Dreams can't be buy"" - First player in the ESL to speak up against it",31853,0.98,1842,kamikazechaser,2021-04-19 12:53:20,https://www.instagram.com/stories/brunofernandes.10/2555307912218377821/?hl=en,False,False
exjhgu,Neymar gets kicked in the back then proceeds to dribble the person who kicked him from the free kick,31751,0.92,1205,VegetarianCannibal_,2020-02-02 05:14:10,https://streamable.com/wdxml,False,False
gkv3lf,Dortmund [1]-0 Schalke 04 : Haaland 29',31410,0.92,1338,paicmhsc,2020-05-16 14:00:06,https://streamja.com/0POv6,False,False
p1xbqt,[Official] Lionel Messi joins PSG,31399,0.92,2970,jranfran,2021-08-10 20:16:11,https://twitter.com/PSG_inside/status/1425189199213473798,False,False
fhot0w,Mikel Arteta tests positive for COVID-19,31384,0.93,1978,AlphaStryk3r,2020-03-12 22:18:43,https://www.arsenal.com/news/club-statement-covid-19,False,False
93xses,Bologna has exercices to reproduce in-game deflected/weird shots for its goalkeepers,31347,0.96,701,Damn-Croissant,2018-08-02 09:27:08,https://v.redd.it/g5jpykvzend11,False,False
zhxbu9,Morocco defeats Portugal to qualify for the semi-final of the World Cup,31215,0.97,3667,enterpriseF-love,2022-12-10 16:56:10,https://www.fifa.com/fifaplus/en/match-centre/match/17/255711/285074/400128140,False,False
iaf2w8,Raheem Sterling brutal miss vs. Lyon 86',31158,0.98,3271,TomasRoncero,2020-08-15 20:44:24,https://www.clippituser.tv/c/qaxply,False,False
k15rza,Boca Juniors turned off all the lights and lit up Diego Maradona's box.,31044,0.98,427,101008,2020-11-26 01:39:49,https://i.redd.it/dhrtkkrwnh161.jpg,False,False
muxh1j,[TALKSPORT] BREAKING: Ed Woodward has resigned as chairman of Manchester United. Woodward’s decision comes after the backlash over the European Super League. - talkSPORT sources understand,30940,0.99,2538,andiirehan,2021-04-20 18:52:07,https://twitter.com/talkSPORT/status/1384580215016460288?s=09,False,False
zed01r,Morocco defeats Spain on penalties and qualifies for the quarter-final of 2022 World Cup,30929,0.97,2429,dragon8811,2022-12-06 17:46:15,https://www.fifa.com/fifaplus/en/match-centre/match/17/255711/285073/400128137,False,False
c46tz6,Cameroon player spits on English player,30722,0.92,1016,ChiefLoneWolf,2019-06-23 16:00:54,https://v.redd.it/7ury441op4631,False,False
cou8s3,Synchronized not kicking the ball in Ekstraklasa,30659,0.97,377,go2kejdz,2019-08-11 08:12:14,https://gfycat.com/pl/breakabledefensiveindianskimmer,False,False
z77drf,Picture of the streaker..,30566,0.89,1477,redemption_time,2022-11-28 20:25:12,https://i.redd.it/ame5nstjls2a1.jpg,False,False
8y7nr8,England's attempt to score after Croatia's winning goal,30434,0.9,3086,LazyDrafter,2018-07-12 07:31:09,https://v.redd.it/voszehq8zg911,False,False
igg87f,[Tyc Sports] Lionel Messi has told Barcelona that he wants to leave. He would make use of the clause in his contract that allows him to terminate his contract unilaterally at the end of each season.,30436,0.99,4697,Radiksas,2020-08-25 17:03:05,https://twitter.com/TyCSports/status/1298303322479382528,False,False
fkncx7,Zinedine Zidane straight red card against Italy 110' (Great header),30141,0.95,1359,serDavosOfSeaworth,2020-03-18 10:21:28,https://v.redd.it/y6ka6c66qen41,False,False
1ewcn5q,Jamie Vardy telling Spurs fans they've won no Premier League titles,30049,0.97,1242,RevertBackwards,2024-08-19 20:44:36,https://v.redd.it/lnunjva8nojd1,False,False
7qvczc,Ronaldinho has officially retired from professional football,30007,0.92,1472,None,2018-01-16 20:40:31,https://twitter.com/goal/status/953365860260941826,False,False
f6y1hf,Ryan Babel rolls around on the floor and pretends to limp to mock Allon Nyom's reaction after Babel gets booked for a foul on Nyom,29984,0.93,900,pastenague,2020-02-20 19:15:30,https://streamable.com/03eiv,False,False
zqlm8o,Messi sleeping with the World Cup trophy,29959,0.94,890,untradablecrespo,2022-12-20 11:04:37,https://i.redd.it/u2efpsklt27a1.jpg,False,False
6goyl5,Michael Bradley goal against Mexico (0-1),29935,0.85,1349,Fusir,2017-06-12 00:38:06,https://streamable.com/bguve,False,False
yzh9r9,"Lionel Messi and Cristiano Ronaldo together for a Louis Vuitton campaign, captured by Annie Leibovitz.",29892,0.96,1329,TheBrownMamba8,2022-11-19 17:33:14,https://i.redd.it/zbolbzcoiz0a1.jpg,False,False
dyy4lb,Tottenham Hotspur announce Jose Mourinho as new manager,29889,0.92,3038,Diegoeh7,2019-11-20 06:34:02,https://www.tottenhamhotspur.com/news/2019/november/jose-mourinho-appointed-new-head-coach/,False,False
u01rio,Video of Ronaldo smashing the kids phone after losing to Everton,29846,0.95,2584,JussVibes,2022-04-09 20:38:29,https://v.redd.it/g8f3phc0eks81,False,False
ohvjtu,[ESPN] Argentina win the Copa America.,29536,0.95,3354,ElKaddouriCSC,2021-07-11 01:51:59,https://twitter.com/espnfc/status/1414039594673266688?s=21,False,False
dbf32k,"OFFICIAL: For every retweet of this tweet, the MLS will be donating $1 to childhood and adolescent cancer research.",29439,0.92,536,GoodSamaritan_,2019-09-30 17:34:08,https://twitter.com/MLS/status/1178717198522753026,False,False
fbhlw7,Post-Match Thread: Watford 3 - 0 Liverpool [ English Premier League ],29407,0.87,3990,EpicRayy,2020-02-29 19:25:18,https://www.reddit.com/r/soccer/comments/fbhlw7/postmatch_thread_watford_3_0_liverpool_english/,False,False
e7jo7c,Barcelona [4]-1 Mallorca - Suarez 43',29348,0.92,1480,digkektzthedream,2019-12-07 20:44:36,https://streamvi.com/watch.php?video=1575751468,False,False
pv72ld,Emi Martinez asking Cristiano to take the PK right in front of Bruno Fernandes,29178,0.97,1407,mattcrvg,2021-09-25 13:46:54,https://v.redd.it/kr7e4r2ulnp71,False,False
9jz7vk,Chelsea 1-[1] Liverpool : Sturridge 89',29015,0.89,2044,paicmhsc,2018-09-29 18:15:01,https://streamja.com/dkan,False,False
uvh8ey,Zlatan Ibrahimovic walks out like a boss during AC Milan’s title celebrations,28990,0.96,825,OnomahIsABaller,2022-05-22 18:41:53,https://v.redd.it/7vmuc5keo2191,False,False
bmap3n,Ajax 2-[3] Tottenham : Lucas 90+6' (agg. 3-3),28914,0.88,4802,paicmhsc,2019-05-08 20:56:55,https://streamja.com/1Xrr,False,False
wo0r7d,"PSG counter attack, Mbappe doesn't get the ball, so he gets angry, turns around and stops running.",28844,0.99,1980,ManuMora98,2022-08-14 07:50:38,https://v.redd.it/60i9d3eswmh91,False,False
4q5lqk,[Post Match Thread] England 1 - Iceland 2,28827,0.88,8928,Man0nTheMoon915,2016-06-27 20:50:18,https://www.reddit.com/r/soccer/comments/4q5lqk/post_match_thread_england_1_iceland_2/,False,False
68o8zb,Watford 0-1 Liverpool (Can 45+2 ') - Brilliant Goal,28734,0.85,1682,PradaBoyDave,2017-05-01 19:47:04,https://my.mixtape.moe/hclyrg.mp4,False,False
15679op,Inter Miami [2] - 1 Cruz Azul - Lionel Messi freekick 90+5',28705,0.97,2142,GerardMoreno,2023-07-22 02:09:44,https://dubz.link/c/9f6725,False,False
8vb4zp,Russia have qualified for the 2018 FIFA World Cup quarter finals. Spain eliminated,28684,0.9,5185,None,2018-07-01 16:41:38,https://twitter.com/FIFAWorldCup/status/1013462572178268160,False,False
9g6e5z,Ibrahimovic goal (LA Galaxy [1]-3 Toronto FC),28649,0.94,1091,AdonalFoyle,2018-09-16 00:25:44,https://streamable.com/u5sl7,False,False
8u6n2o,"Reporter to Messi: ""After the first game I gave you a good luck amulet that my wife gave me, I don't know if you threw it away or something..."" Messi proceeds to show reporter he wore it all along and reporter can't believe it. Top lad.",28540,0.94,1030,InterRail,2018-06-27 04:21:09,https://www.youtube.com/watch?v=bfUd6uCijhU,False,False
z1s2n0,Arabic commentary for the Saudi Arabia goal vs Argentina,28492,0.97,1235,kennykip,2022-11-22 12:15:06,https://v.redd.it/939wa1myuh1a1,False,False
9qhnek,Arsenal [3]-1 Leicester City - Aubameyang 66',28425,0.92,1502,HerbalDreamin,2018-10-22 20:23:21,https://www.clippituser.tv/c/qvlvpz,False,False
oidi99,Bonucci yelling “It’s coming to Rome!” at the camera,28230,0.89,2949,efranklin13,2021-07-11 21:57:27,https://streamable.com/cd5sd5,False,False
8rkgxr,Bakary Gassamo is referee of the Peru v Denmark World Cup game. Here's a reminder of his credentials.,28006,0.96,655,l-Made-This,2018-06-16 16:29:30,https://gfycat.com/admirableshyelectriceel,False,False
p0casd,Lionel Messi gets a standing ovation at his press conference.,27890,0.97,1663,_hopelessnobody,2021-08-08 10:27:00,https://streamable.com/gjezda,False,False
9ez6hj,Son's sweet nutmeg pass vs. Chile,27847,0.95,594,tottenhamhotpocket,2018-09-11 16:41:15,https://i.redd.it/qzk45nn21nl11.gif,False,False
zh3mwp,Croatia defeats Brazil on penalties and qualifies for the semi-final of 2022 World Cup,27824,0.98,4746,honestlynotBG,2022-12-09 17:46:36,https://www.fifa.com/fifaplus/en/match-centre/match/17/255711/285074/400128141?country=MY&wtw-filter=ALL,False,False
c93p1h,Arjen Robben officially ends his career.,27791,0.93,1312,Rocr,2019-07-04 15:12:25,https://nos.nl/l/2292044,False,False
bmps57,"For the first time in the history of the European club competitions, both the Champions League and Europa League finals will be contested by teams all from one nation - Liverpool, Tottenham, Arsenal and Chelsea of England.",27759,0.92,2778,soggypastry,2019-05-09 21:47:05,https://www.reddit.com/r/soccer/comments/bmps57/for_the_first_time_in_the_history_of_the_european/,False,False
8y31il,Mandzukic (Croatia) goal vs. England ([2]-1),27746,0.83,3672,TomasRoncero,2018-07-11 20:21:19,https://www.clippituser.tv/c/lnmmya,False,False
8z3aig,Luka Modrić wins the 2018 World Cup Golden Ball,27723,0.92,1681,shakira11,2018-07-15 17:23:15,https://twitter.com/FIFAWorldCup/status/1018546521501925377,False,False
dypfl7,Mauricio Pochettino has left Tottenham Hotspur,27644,0.9,4490,NinthCinema,2019-11-19 19:36:17,https://www.tottenhamhotspur.com/news/2019/november/mauricio-leaves-club/,False,False
blw2ve,Post-Match Thread: Liverpool 4-0 Barcelona [4-3 on agg.],27625,0.89,9208,MisterBadIdea2,2019-05-07 20:55:23,https://www.reddit.com/r/soccer/comments/blw2ve/postmatch_thread_liverpool_40_barcelona_43_on_agg/,False,False
f5z7vg,Dortmund [2]-1 PSG : Haaland 77',27599,0.92,2385,paicmhsc,2020-02-18 21:34:06,https://streamja.com/pNza,False,False
fpigx1,Former Ajax player Abdelhak Nouri wakes up from a 2.5 year coma. Appie is out of his coma and can be in a wheelchair.,27543,0.95,852,absolutely-not-nsa,2020-03-26 20:00:08,https://www.vtbl.nl/nieuws/artikel/5071276/familie-nouri-komt-met-update-over-appie-hij-wakker,False,False
i9txqv,Barcelona 2-[8] Bayern Munich: Philippe Coutinho goal 88',27520,0.98,3837,TomasRoncero,2020-08-14 20:45:19,https://streamable.com/pvyeij,False,False
rd8bzd,Proper shithousery in colombian league,27521,0.99,425,refki-_-,2021-12-10 13:11:30,https://v.redd.it/2nnqvu47sp481,False,False
bd4n55,Liverpool [2]-0 Chelsea : Salah 53',27519,0.88,2283,paicmhsc,2019-04-14 16:41:47,https://streamja.com/OM6O,False,False
10l74cd,Burnley announcement video of their new signing Lyle Foster,27503,0.99,415,rucola-ass,2023-01-25 19:22:47,https://v.redd.it/1hrd8gfmp8ea1,False,False
cyfb36,"Amazing goal, Puskas worthy!!Eskişehirspor 0 - |2| Bursaspor",27487,0.95,466,erp_turk,2019-09-01 20:44:45,https://v.redd.it/inr349k8o1k31,False,False
dnh45s,Burnley 0-[3] Chelsea - Pulisic 56',27461,0.87,3293,digkektzthedream,2019-10-26 17:41:46,https://streamvi.com/watch.php?video=1572111698,False,False
s1nrx2,A compilation of Mohamed Kamara (Sierra Leone goalkeeper) and his weird yet great goalkeeping technique that saw him keep a cleansheet & win Man of the Match vs. Algeria today,27387,0.98,1017,Fati25,2022-01-11 21:13:22,https://v.redd.it/br63pbkxj4b81,False,False
bvpgi4,Liverpool have won the 2018-19 UEFA Champions League,27366,0.79,3605,HancokUndead,2019-06-01 20:56:46,http://www.uefa.com/uefachampionsleague/season=2019/matches/round=2000984/match=2025486/,False,False
jk9fho,"[REGIONE LOMBARDIA] Zlatan Ibrahimovic: ""The virus challenged me and I won. But you are not Zlatan, don't challenge the virus. Social distancing and masks, always.""",27330,0.95,750,Cromulent-Username,2020-10-29 12:51:11,https://twitter.com/rassegnagram/status/1321775054649204738,False,False
e889kt,Russia handed four-year ban from major sporting events (including 2022 World Cup) by World Anti-Doping Agency,27249,0.95,1110,Alpha_Jazz,2019-12-09 10:28:14,https://www.bbc.co.uk/sport/olympics/50710598,False,False
ojcd7n,Marcus Rashford's mural in Withington being repaired by street artist Akse 🧑‍🎨,27173,0.95,687,NiftyERA,2021-07-13 09:55:14,https://v.redd.it/webd6ey3dya71,False,False
u6jitc,Cristiano Ronaldo’s son has passed away.,26949,0.97,1325,wais100,2022-04-18 18:10:38,https://i.redd.it/v3anus9uvbu81.jpg,False,False
8nhkni,Zinedine Zidane steps down from Real Madrid,26927,0.91,3583,horsetrich,2018-05-31 11:15:08,https://www.bbc.co.uk/sport/football/44315700,False,False
c22vuf,Referee trolls player,26913,0.96,441,unammusic,2019-06-18 14:25:36,https://v.redd.it/cs4wu8u3k4531,False,False
crc95c,Athletic Bilbao [1]-0 Barcelona : Aduriz 89',26881,0.93,1430,paicmhsc,2019-08-16 20:47:58,https://streamja.com/16dP,False,False
qzpxro,Jose Mourinho buys Felix Afena-Gyan the shoes he promised him,26859,0.98,1148,Gungerz,2021-11-22 16:56:39,https://v.redd.it/bn8pzgulg6181,False,False
btk4n8,"Emery: ""Arsenal's environment is all about respect. When I was at PSG , I tried to communicate in French but people were sarcastically mocking my efforts. Here at Arsenal, I speak broken English but all I hear is complementary words for putting the efforts in and trying to speak""",26790,0.94,2182,It_TheGab,2019-05-27 09:49:31,https://www.elmundo.es/deportes/futbol/2019/05/27/5ceafeeefc6c83ef358b468f.html,False,False
hfsu9l,Chelsea 1-0 Manchester City: Christian Pulisic goal 36',26719,0.93,2800,TomasRoncero,2020-06-25 19:51:13,https://www.clippituser.tv/c/mvbvpp,False,False
